schulnummer,schulname,school_type,schulkategorie,schulform_raw,klassenstufe,strasse,plz,ort,stadt,bundesland,ortsteil,latitude,longitude,telefon,fax,email,website,traegerschaft,traeger_name,form_der_privatschule,schulleitung,stv_schulleitung,schueler_gesamt,klassenzahl,unterrichtszeit,unterrichtszeit_erlaeuterung,profile,sonstige_profile,foerderschwerpunkt,unterrichtssprache,fruehe_fremdsprache,erste_fremdsprache,zweite_fremdsprache,dritte_fremdsprache,sprachen,art_des_angebots,ganztagsform,besonderheiten,besonderheiten_erlaeuterung,auszeichnungen,foerderverein,schulbibliothek,namensgebung,berufsbereiche,ausbildungsberufe,schulform_bemerkung,ndh_count,sw_portal_url,sw_portal_slug,data_source,data_retrieved,schueler_2024_25
SW-anni-albers-schule-fuer-mode-medien-und-gestaltung,"Anni-Albers-Schule für Mode, Medien und Gestaltung",Berufliche Schule,weiterfuehrende-berufliche-schulen,"Berufliche Schule, Bildungsgänge zur Berufsvorbereitung (BzB), Fachoberschule, Zweijährige Berufsfachschule, Zweijährige Höhere Berufsfachschule, Mehrjährige Berufsfachschule, Weiterführende berufliche Schule",,Hamburger Allee 23,60486,Frankfurt am Main,Frankfurt am Main,Hessen,Bockenheim,50.114498,8.6471781,+49 69 212 35268,+49 69 212 40520,poststelle.anni-albers-schule@stadt-frankfurt.de,http://www.annialbersschule.de,Stadt Frankfurt am Main,,,Dr. Anne-Kathrin Reich,Dr. Kathrin Köster,750.0,49.0,,,,,,Deutsch,,Englisch,,,Englisch,,,"Jugendhilfeangebot, Pausenverkauf, Weitere Angebote:",,,"""Verein zur Förderung der Frankfurter Schule für Bekleidung und Mode e.V.""",,,"Bekleidungstechnik, Körperpflege, Technik - Schwerpunkt Textiltechnik und Bekleidung, Textiltechnik und Bekleidung","Änderungsschneider/in, Friseur/in, Kosmetiker/in, Maßschneider/in, Modist/in, Textil und Modenäher/in, Textil- und Modeschneider/in, Textilreiniger/in",,,https://frankfurt.de/themen/arbeit-bildung-und-wissenschaft/bildung/schulwegweiser/weiterfuehrende-berufliche-schulen/anni-albers-schule-fuer-mode-medien-und-gestaltung,anni-albers-schule-fuer-mode-medien-und-gestaltung,Frankfurt Schulwegweiser,2026-04-06,
4392,Begemann Schule,Berufliches Gymnasium,weiterfuehrende-berufliche-schulen,"Berufliches Gymnasium, Weiterführende berufliche Schule",,Hansaallee 18,60322,Frankfurt am Main,Frankfurt am Main,Hessen,Westend,50.1245098,8.6739742,+49 69 550689,+49 69 592689,info@begemannschule.de,http://www.begemannschule.de,Private Träger,Begemann Schule gGmbH,,Herr Dr. Erich Langendorf,,78.0,,,,,,,Deutsch,,Englisch,Französisch,,"Englisch, Französisch",,,,,,,,Gegründet von dem Ehepaar Heinz und Thekla Begemann,Wirtschaft,,,,https://frankfurt.de/themen/arbeit-bildung-und-wissenschaft/bildung/schulwegweiser/weiterfuehrende-berufliche-schulen/begemann-schule,begemann-schule,Frankfurt Schulwegweiser,2026-04-06,33
SW-bergiusschule,Bergiusschule,Berufliche Schule,weiterfuehrende-berufliche-schulen,"Berufliche Schule, Fachoberschule, Fachschule für Lebensmitteltechnik, Zweijährige Berufsfachschule, Bildungsgänge zur Berufsvorbereitung (BzB), Weiterführende berufliche Schule",,Frankensteiner Platz 1-5,60594,Frankfurt am Main,Frankfurt am Main,Hessen,Sachsenhausen,50.1066715,8.6917217,+49 69 212 33050,+49 69 212 30774,info@bergiusschule.de,http://www.bergiusschule.de,Stadt Frankfurt am Main,,,Susanne Albert,Dr. Frank Krause,1400.0,90.0,siehe Erläuterung der Unterrichtszeit,,,,,Deutsch,,"Englisch, Französisch, Spanisch",,,"Englisch, Französisch, Spanisch",,,"Pausenverkauf, Schüleraustausch",,,Förderung der Deutschkenntnisse,,"Dr. Friedrich Bergius geb. 1884 in Goldschmieden / Breslau, verstorben 1949 in Buenos Aires, Chemiker. Er entwickelte das nach ihm benannte Verfahren zur Herstellung von Benzin aus Kohle sowie zur Zuckergewinnung aus Holz (Zellstoffspaltung). 1931 erhielt er den Nobelpreis.","Ernährung und Hauswirtschaft, Gastronomie, Hotellerie","Bäcker/in, Konditor/in, Fachkraft für Gastronomie, Fachkraft Küche, Fachmann/-frau für Systemgastronomie, Fleischer/in, Hotelfachmann/-frau, Kaufmann/-frau für Hotelmanagement, Koch/Köchin, Lebensmittelfachverkäufer/in, Fachmann/frau für Restaurants und Veranstaltungsservice",Zweijähriger Fachschule in Teilzeit,,https://frankfurt.de/themen/arbeit-bildung-und-wissenschaft/bildung/schulwegweiser/weiterfuehrende-berufliche-schulen/bergiusschule,bergiusschule,Frankfurt Schulwegweiser,2026-04-06,
SW-berufliche-schulen-berta-jourdan,Berufliche Schulen Berta Jourdan,Berufliche Schule,weiterfuehrende-berufliche-schulen,"Berufliche Schule, Berufsfachschule zum Übergang in Ausbildung – BÜA, Fachoberschule, Zweijährige Höhere Berufsfachschule, InteA, Weiterführende berufliche Schule",,Adlerflychtstraße 24,60318,Frankfurt am Main,Frankfurt am Main,Hessen,Nordend,50.1241792,8.6830019,+49 69 212 35271,+49 69 212 40521,poststelle.berufliche-schulen-berta-jourdan@stadt-frankfurt.de,http://www.berta-jourdan.de,Stadt Frankfurt am Main,,,Inge Meichsner,Michael Baumeister,1800.0,88.0,08:00 bis 16:00 Uhr,,,,,Deutsch,,Englisch,,,Englisch,,,"Mittagessen, Pausenverkauf",,,"""Verein der Freundinnen/Freunde und Förderer der Beruflichen Schulen Berta Jourdan"", Ansprechpartner/in: Frau Oberländer",,"Berta Jourdan (1892-1981), Sozial- und Bildungspolitikerin in Frankfurt am Main, die sich neben ihrer Tätigkeit als Pädagogin in erzieherischen und sozialen Fragen stark engagierte.","Ernährung und Hauswirtschaft, Sozialassistenz, Sozialpädagogik, Sozialpflegerische und sozialpädagogische Berufe, Erziehungswissenschaft","Erzieher/in, Hauswirtschafter/in, Helfer/in in der Hauswirtschaft, Sozialassistent/in",Fachschule für Sozialwesen,,https://frankfurt.de/themen/arbeit-bildung-und-wissenschaft/bildung/schulwegweiser/weiterfuehrende-berufliche-schulen/berufliche-schulen-berta-jourdan,berufliche-schulen-berta-jourdan,Frankfurt Schulwegweiser,2026-04-06,
SW-berufsfachschule-fuer-kosmetik-make-up-s-schaefer-famous-face-academy,Berufsfachschule für Kosmetik S. Schäfer,Berufliche Schule,weiterfuehrende-berufliche-schulen,"Berufliche Schule, Weiterführende berufliche Schule",,Kaiserstraße 6,60311,Frankfurt am Main,Frankfurt am Main,Hessen,Innenstadt,50.1114768,8.6760464,+49 69 250144,,info@ffa-makeup.com,http://www.kosmetikfachschule.de,Private Träger,Sevgi Schäfer,Staatlich anerkannte Ergänzungsschule,Sevgi Schäfer,,40.0,,,,,,,Deutsch,,,,,,,,,,,,,,"Kosmetik, Gesundheit",Kosmetiker/in,Schulverbund der Kosmetikfachschule Schäfer und der Kosmetikfachschule Janina Bilski,,https://frankfurt.de/themen/arbeit-bildung-und-wissenschaft/bildung/schulwegweiser/weiterfuehrende-berufliche-schulen/berufsfachschule-fuer-kosmetik-make-up-s-schaefer-famous-face-academy,berufsfachschule-fuer-kosmetik-make-up-s-schaefer-famous-face-academy,Frankfurt Schulwegweiser,2026-04-06,
3135,Bethmannschule,Berufliche Schule,weiterfuehrende-berufliche-schulen,"Berufliche Schule, Berufsfachschule zum Übergang in Ausbildung – BÜA, Zweijährige Höhere Berufsfachschule, Fachoberschule, Weiterführende berufliche Schule",,Paul-Arnsberg-Platz 5,60314,Frankfurt am Main,Frankfurt am Main,Hessen,Ostend,50.1104217,8.6987026,+49 69 212 33065,+49 69 212 30730,info@bethmannschule.de,http://www.bethmannschule.de,Stadt Frankfurt am Main,,,Ariane Hoffmann,Gerd Wölfel,1150.0,56.0,08:00 bis 21:50 Uhr,,Gewaltprävention (Mediation / Konfliktschlichtung),,,,,"Englisch, Weitere Sprachangebote:",,,"Englisch, Weitere Sprachangebote:",,,"Gewaltprävention, Pausenverkauf",,,"""Förderverein der Bethmannschule"", Ansprechpartner: Herr Raab",Öffnungszeiten: Klassenweise nach Bedarf; Konzept: Reine Präsenzbibliothek,Benannt nach der bekannten Frankfurter Bankiersfamilie,"Informationsverarbeitung - Wirtschaft, Wirtschaft - Schwerpunkt Wirtschaft und Verwaltung, Wirtschaft und Verwaltung","Bankkaufmann/-frau, Industriekaufmann/-frau, Informatikkaufmann/-frau, Informations- und Telekommunikations-Systemkaufmann/-frau, Investmentfondskaufmann/-frau, Luftverkehrskaufmann/-frau, Tourismuskaufmann/-frau","weitere Angebote: Assistentenausbildung Datenverarbeitung, Wirtschaft, Bürowirtschaft; Fachoberschule für berufstätige Erwachsene (Form B - Teilzeit: dienstags und donnerstag abends, Samstag)",,https://frankfurt.de/themen/arbeit-bildung-und-wissenschaft/bildung/schulwegweiser/weiterfuehrende-berufliche-schulen/bethmannschule,bethmannschule,Frankfurt Schulwegweiser,2026-04-06,367
SW-european-school-of-design,European School of Design,Berufliche Schule,weiterfuehrende-berufliche-schulen,"Berufliche Schule, Weiterführende berufliche Schule",,Hamburger Allee 45,60486,Frankfurt am Main,Frankfurt am Main,Hessen,Bockenheim,50.1157829,8.6441501,+49 69 70795921,,study@europeanschoolofdesign.eu,http://www.europeanschoolofdesign.eu,Private Träger,Freier Träger,,Detlef Wildermuth,Ralph Thamm,,,,,,,,Deutsch,,Englisch,,,Englisch,,,,,,,,,,,,,https://frankfurt.de/themen/arbeit-bildung-und-wissenschaft/bildung/schulwegweiser/weiterfuehrende-berufliche-schulen/european-school-of-design,european-school-of-design,Frankfurt Schulwegweiser,2026-04-06,
SW-frankfurter-akademie-fuer-kommunikation-und-design,Frankfurter Akademie für Kommunikation und Design,Berufliche Schule,weiterfuehrende-berufliche-schulen,"Berufliche Schule, Weiterführende berufliche Schule",,Ostparkstraße 47-49,60385,Frankfurt am Main,Frankfurt am Main,Hessen,Ostend,50.1161601,8.7133234,+49 69 439938,+49 69 4990506,info@academy-of-visual-arts.de,http://www.academy-of-visual-arts.de,Private Träger,Freier Träger,,Seyyal Carnetto und Tomaso Carnetto,,160.0,,,,,,,,,,,,,,,,,,,,,,,,,https://frankfurt.de/themen/arbeit-bildung-und-wissenschaft/bildung/schulwegweiser/weiterfuehrende-berufliche-schulen/frankfurter-akademie-fuer-kommunikation-und-design,frankfurter-akademie-fuer-kommunikation-und-design,Frankfurt Schulwegweiser,2026-04-06,
SW-franz-boehm-schule,Franz-Böhm-Schule,Berufliche Schule,weiterfuehrende-berufliche-schulen,"Berufliche Schule, Fachoberschule, Zweijährige Berufsfachschule, Bildungsgänge zur Berufsvorbereitung (BzB), Weiterführende berufliche Schule",,Eichendorffstraße 67-69,60320,Frankfurt am Main,Frankfurt am Main,Hessen,Dornbusch,50.1420058,8.6624825,Fachoberschule Form A,+49 69 212 48170,poststelle.franz-boehm-schule@stadt-frankfurt.de,http://www.franz-boehm-schule.de,Stadt Frankfurt am Main,,,Thomas Möller,Holger Kunz,1598.0,85.0,,,,,,Deutsch,,Englisch,,,Englisch,,,"Gewaltprävention, Kooperationspartner",,Umweltschule,Förderverein der Franz-Böhm-Schule; Ansprechpartner: Herr Stuber; thomas.stuber@schule.hessen.de,,"Franz Böhm, Vordenker der Sozialen Marktwirtschaft, Vater der Kartellgesetzgebung, Mitinitiator des Bundesentschädigungsgesetzes und Wegbereiter der Aussöhnung mit Israel","Arbeitsmarktdienstleistungen, Automobil, Einzelhandel, Informationsverarbeitung - Technik, Sozialversicherung, Wirtschaft - Schwerpunkt Wirtschaftsinformatik, Wirtschaft - Schwerpunkt Wirtschaft und Verwaltung, Wirtschaft und Verwaltung","Automobilkaufmann/-frau, Fachangestellte/r für Arbeitsförderung, Kaufmann/Kauffrau im Einzelhandel, Sozialversicherungsangestellte/r, Verkäufer/in",,,https://frankfurt.de/themen/arbeit-bildung-und-wissenschaft/bildung/schulwegweiser/weiterfuehrende-berufliche-schulen/franz-boehm-schule,franz-boehm-schule,Frankfurt Schulwegweiser,2026-04-06,
SW-hans-boeckler-schule,Hans-Böckler-Schule,Berufliche Schule,weiterfuehrende-berufliche-schulen,"Berufliche Schule, Bildungsgänge zur Berufsvorbereitung (BzB), Zweijährige Berufsfachschule, Weiterführende berufliche Schule",,Rohrbachstraße 38,60389,Frankfurt am Main,Frankfurt am Main,Hessen,Nordend,50.1287547,8.6968961,+49 69 212 34409,+49 69 212 40530,poststelle.hans-boeckler-schule@stadt-frankfurt.de,http://www.hans-boeckler-schule.eu/,Stadt Frankfurt am Main,,,Martin Böhm,N.N.,1400.0,60.0,08:00 bis 15:10 Uhr,,,,,Deutsch,,"Englisch, Weitere Sprachangebote:",,,"Englisch, Weitere Sprachangebote:",,,"Förderung der Deutschkenntnisse, Pausenverkauf, Schüleraustausch",,,,,"Hans Böckler (1895 - 1951), Erster Vorsitzender des Deutschen Gewerkschaftsbundes nach dem 2. Weltkrieg. ""Vater"" der Mitbestimmung.",Wirtschaft und Verwaltung,"Immobilienkaufmann/-frau, Justizfachangestellte/r, Notarfachangestellte/r, Patentanwaltsfachangestellte/r, Rechtsanwalts- und Notarfachangestellte/r, Rechtsanwaltsfachangestellte/r, Steuerfachangestellte/r, Verwaltungsfachangestellte/r",,,https://frankfurt.de/themen/arbeit-bildung-und-wissenschaft/bildung/schulwegweiser/weiterfuehrende-berufliche-schulen/hans-boeckler-schule,hans-boeckler-schule,Frankfurt Schulwegweiser,2026-04-06,
3112,Heinrich-Kleyer-Schule,Berufliche Schule,weiterfuehrende-berufliche-schulen,"Berufliche Schule, Berufliches Gymnasium, Bildungsgänge zur Berufsvorbereitung (BzB), Fachoberschule, Zweijährige Berufsfachschule, Weiterführende berufliche Schule",,Kühhornshofweg 27,60320,Frankfurt am Main,Frankfurt am Main,Hessen,Nordend,50.1360494,8.6821235,+49 69 212 35148,+49 69 212 30732,poststelle.heinrich-kleyer-schule@stadt-frankfurt.de,http://www.heinrich-kleyer-schule.de,Stadt Frankfurt am Main,,,Klaus Sandrock,,2888.0,117.0,07:30 bis 21:00 Uhr,,,,,,,Englisch,Französisch,,"Englisch, Französisch",,,"Jugendhilfeangebot, Mittagessen, Schüleraustausch",,,Verein der Freunde und Förderer der Heinrich-Kleyer-Schule e.V.,Von der Stadtbücherei aufgebaut und organisiert. Öffnungszeiten: 9:45 Uhr bis 14:15 Uhr. Ansprechpartnerin: Frau Boß,"Heinrich Kleyer (1853 - 1932), Gründer der ""Adler-Werke""","Fahrzeugtechnik, Maschinenbautechnik, Mechatronik, Metalltechnik","Augenoptiker/in, Eisenbahner/in im Betriebsdienst, Fahrradmonteur/in, Feinwerkmechaniker/in, Industriemechaniker/in, Karosserie- und Fahrzeugbaumechaniker/in, Kostruktionsmechaniker/in, Kraftfahrzeugmechatroniker/in - verschiedene Schwerpunkte, Mechatroniker/in, Metallbauer/in verschiedene Fachrichtungen, Zerspanungsmechaniker/in, Zweiradmechaniker/in",,,https://frankfurt.de/themen/arbeit-bildung-und-wissenschaft/bildung/schulwegweiser/weiterfuehrende-berufliche-schulen/heinrich-kleyer-schule,heinrich-kleyer-schule,Frankfurt Schulwegweiser,2026-04-06,371
SW-hochschule-fresenius,Hochschule Fresenius,Berufliche Schule,weiterfuehrende-berufliche-schulen,"Berufliche Schule, Weiterführende berufliche Schule",,Marienburgstraße 2,60528,Frankfurt am Main,Frankfurt am Main,Hessen,Niederrad,50.0920074,8.6478414,+49 69 247514252,+49 69 247514260,gesundheit-frankfurt@hs-fresenius.de,http://www.hs-fresenius.de,Private Träger,Hochschule Fresenius gem. GmbH,,,,,,,,,,,Deutsch,,,,,,,,,,,,,,"Gesundheit, Sozialwesen","Erzieher/in, Sozialassistent/in",Höhere Berufsfachschule für Sozialassistenz und Fachschule für Sozialpädagogik,,https://frankfurt.de/themen/arbeit-bildung-und-wissenschaft/bildung/schulwegweiser/weiterfuehrende-berufliche-schulen/hochschule-fresenius,hochschule-fresenius,Frankfurt Schulwegweiser,2026-04-06,
4393,IKS - Interkulturelle Schule Rhein-Main,Berufliche Schule,weiterfuehrende-berufliche-schulen,"Berufliche Schule, Fachoberschule, Weiterführende berufliche Schule",,Kaiserkronenweg 1,60433,Frankfurt am Main,Frankfurt am Main,Hessen,Preungesheim,50.1659552,8.6808351,+49 69 27997180,+49 69 27997182,info@iks-schule.de,http://www.iks-rhein-main.de,Private Träger,EAE European Academy of Economics gGmbH,"Staatlich genehmigte Ersatzschule, Staatlich anerkannte Ersatzschule",Dr. I. Özkan,,199.0,,,,,,,Deutsch,,,,,,,,Mittagessen,,,,,,Wirtschaft und Verwaltung,"Bürokraft, Kaufmann/Kauffrau für Bürokommunikation, Kaufmann/Kauffrau für Dialogmarketing, Kaufmann/Kauffrau für Marketingkommunikation",,,https://frankfurt.de/themen/arbeit-bildung-und-wissenschaft/bildung/schulwegweiser/weiterfuehrende-berufliche-schulen/iks---interkulturelle-schule-rhein-main,iks---interkulturelle-schule-rhein-main,Frankfurt Schulwegweiser,2026-04-06,201
SW-julius-leber-schule,Julius-Leber-Schule,Fachoberschule,weiterfuehrende-berufliche-schulen,"Berufsschule, Fachoberschule, Weiterführende berufliche Schule",,Seilerstraße 32,60313,Frankfurt am Main,Frankfurt am Main,Hessen,Innenstadt,50.1166227,8.6912399,+49 69 212 34408,+49 69 212 40519,poststelle.julius-leber-schule@stadt-frankfurt.de,http://www.julius-leber-schule.de,Stadt Frankfurt am Main,,,Oliver Schulz,Ulrike Janßen,2700.0,120.0,08:00 bis 17:00 Uhr,,,,,Deutsch,,Englisch,,,Englisch,,,"Angebote zur beruflichen Orientierung, Jugendhilfeangebot",,Engagierte Schule im Kampf gegen Blutkrebs „Wir retten Leben“ DKMS; Grenzenlos-Schule: Globales Lernen in der beruflichen Bildung; Schule im Trialog der Kulturen; Nachhaltigkeit lernen in Hessen: Lernen und Handeln für unsere Zukunft,"""Verein zur Förderung der beruflichen Bildung an der Julius-Leber-Schule e.V.""",,"Julius Leber (1891 - 1945), Sozialdemokrat, Publizist. Mitglied des Reichtages (1924 - 1933) , Widerstandskämpfer","Gesundheit, Wirtschaft - Schwerpunkt Wirtschaft und Verwaltung","Fachkraft für Kurier-, Express- und Postdienste, Kaufmann/Kauffrau für Kurier-, Express- und Postdienste, Kaufmann/Kauffrau für Spedition und Logistikdienste, Kaufmann/Kauffrau für Verkehrsservice, Medizinische/r Fachangestellte/r, Pharmazeutisch-kaufmännischer/r Angestellte/r, Tiermedizinische/r Fachangestellte/r, Zahnmedizinische/r Fachangestellte/r",,,https://frankfurt.de/themen/arbeit-bildung-und-wissenschaft/bildung/schulwegweiser/weiterfuehrende-berufliche-schulen/julius-leber-schule,julius-leber-schule,Frankfurt Schulwegweiser,2026-04-06,
SW-klingerschule,Klingerschule (Weiterführende berufliche Schule),Berufsschule,weiterfuehrende-berufliche-schulen,"Berufsschule, Berufliches Gymnasium, Berufsfachschule zum Übergang in Ausbildung – BÜA, Zweijährige Höhere Berufsfachschule, Weiterführende berufliche Schule",,Hermesweg 10,60316,Frankfurt am Main,Frankfurt am Main,Hessen,Nordend,50.1185018,8.6933852,+49 69 212 33749,+49 69 212 35838,poststelle.klingerschule@stadt-frankfurt.de,https://www.klingerschule.com/,Stadt Frankfurt am Main,,,Annette Grawenhoff,,1000.0,49.0,08:00 bis 16:45 Uhr,,,,,Deutsch,,Englisch,"Spanisch, Weitere Sprachangebote",,"Englisch, Spanisch, Weitere Sprachangebote",,,"Jugendhilfeangebot, Angebote zur beruflichen Orientierung, Gewaltprävention, Schüleraustausch",,,"""Förderverein der Klingerschule Frankfurt am Main e.V.""",Von der Stadtbücherei aufgebaut und organisiert.,Friedrich-Maximilian Klinger (1752 - 1831),"Wirtschaft, Gesundheit, Erziehungswissenschaft","Kaufmann/Kauffrau für Versicherung und Finanzen, Kaufmann/Kauffrau für Gesundheitswesen, Erläuterungen zu den Schulformen",,,https://frankfurt.de/themen/arbeit-bildung-und-wissenschaft/bildung/schulwegweiser/weiterfuehrende-berufliche-schulen/klingerschule,klingerschule,Frankfurt Schulwegweiser,2026-04-06,
3158,Ludwig-Erhard-Schule,Berufsfachschule zum Übergang in Ausbildung – BÜA,weiterfuehrende-berufliche-schulen,"Berufsfachschule zum Übergang in Ausbildung – BÜA, Berufsschule, Fachoberschule Form A, Weiterführende berufliche Schule",,Legienstraße 5,65929,Frankfurt am Main,Frankfurt am Main,Hessen,Unterliederbach,50.1108686,8.5345941,+49 69 212 43900,+49 69 212 43666,poststelle.ludwig-erhard-schule@stadt-frankfurt.de,http://www.les-frankfurt.de,Stadt Frankfurt am Main,,,Bernhard Friedrich,Petra Schaub,1445.0,70.0,7:55 bis 16:40 Uhr,,,,,Deutsch,,"Englisch, Weitere Sprachangebote, Französisch, Spanisch",,,"Englisch, Weitere Sprachangebote, Französisch, Spanisch",,,Pausenverkauf,,,"""Förderverein der Ludwig-Erhard-Schule e.V."", Ansprechpartner/in: Herr Uwe Kunz",,"Ludwig Erhard (1897 - 1977), Deutscher Bundeskanzler",Wirtschaft und Verwaltung,"Kaufmann/Kauffrau im Einzelhandel, Kaufmann/Kauffrau für Büromanagement, Kaufmann/Kauffrau für Dialogmarketing, Servicekraft für Dialogmarketing, Verkäufer/in, Industriekaufmann/-frau",,,https://frankfurt.de/themen/arbeit-bildung-und-wissenschaft/bildung/schulwegweiser/weiterfuehrende-berufliche-schulen/ludwig-erhard-schule,ludwig-erhard-schule,Frankfurt Schulwegweiser,2026-04-06,214
SW-mediacampus---schule-des-deutschen-buchhandels,mediacampus frankfurt GmbH,Berufliche Schule,weiterfuehrende-berufliche-schulen,"Berufliche Schule, Weiterführende berufliche Schule",,Wilhelmshöher Straße 283,60389,Frankfurt am Main,Frankfurt am Main,Hessen,Seckbach,50.1501909,8.7391395,+49 69 9474000,+49 69 94740050,info@mediacampus-frankfurt.de,http://www.mediacampus-frankfurt.de,Private Träger,Börsenverein GmbH,Staatlich anerkannte Ersatzschule,Nele Drewello,,599.0,,,,,,,,,,,,,,,,,,,,,,"Buchhändler/in, Kaufmann/Kauffrau im Einzelhandel, Medienkaufmann/-frau Digital und Print, Kaufmann/-frau im E-Commerce",,,https://frankfurt.de/themen/arbeit-bildung-und-wissenschaft/bildung/schulwegweiser/weiterfuehrende-berufliche-schulen/mediacampus---schule-des-deutschen-buchhandels,mediacampus---schule-des-deutschen-buchhandels,Frankfurt Schulwegweiser,2026-04-06,
6121,Paul-Ehrlich-Schule,Fachoberschule,weiterfuehrende-berufliche-schulen,"Berufsschule, Bildungsgänge zur Berufsvorbereitung (BzB), Fachoberschule, Weiterführende berufliche Schule",,Brüningstraße 2,65929,Frankfurt am Main,Frankfurt am Main,Hessen,Höchst,50.0979105,8.5436315,+49 69 212 45506,+49 69 212 45765,poststelle.paul-ehrlich-schule@stadt-frankfurt.de,http://www.paul-ehrlich-schule.de,Stadt Frankfurt am Main,,,Dr. Eva Kaufmann,Robert König,1600.0,85.0,siehe Erläuterung der Unterrichtszeit,,,,,Deutsch,,Englisch,,,Englisch,,,Schülerzeitung,,,,,Seit 1959 nach dem Mediziner und Naturwissenschaftler Paul Ehrlich (1854 - 1915) benannt. Er arbeitete sehr erfolgreich bei den Farbwerken Höchst auf dem Gebiet der Chemotherapie und erhielt dafür 1908 den Nobelpreis für Medizin,"Chemie, Physik, Biologie, Technik - Schwerpunkt Chemisch-physikalische Technik, Gesundheit","Biologielaborant/in, Chemielaborant/in, Chemikant/in, Drogist/in, Orthopädieschumacher/in, Pharmakant/in, Produktionsfachkraft Chemie, Tierpfleger/in, Zahntechniker/in",,40.0,https://frankfurt.de/themen/arbeit-bildung-und-wissenschaft/bildung/schulwegweiser/weiterfuehrende-berufliche-schulen/paul-ehrlich-schule,paul-ehrlich-schule,Frankfurt Schulwegweiser,2026-04-06,674
SW-philipp-holzmann-schule,Philipp-Holzmann-Schule,Fachoberschule,weiterfuehrende-berufliche-schulen,"Berufsschule, Berufliches Gymnasium, Fachoberschule, Berufsfachschule zum Übergang in Ausbildung – BÜA, Bildungsgänge zur Berufsvorbereitung (BzB), InteA, Weiterführende berufliche Schule",,Siolistraße 41,60323,Frankfurt am Main,Frankfurt am Main,Hessen,Westend,50.1300646,8.6646231,+49 69 212 34422,+49 69 212 30791,poststelle.philipp-holzmann-schule@stadt-frankfurt.de,http://www.Philipp-Holzmann-Schule.de,Stadt Frankfurt am Main,,,Yvonne Sprock,Torsten Kolb,2400.0,120.0,7:30 bis 14:45 Uhr,,,,,Deutsch,,Englisch,,,Englisch,,,"Gewaltprävention, Pausenverkauf, Schüleraustausch",,,"""Förderverein Philipp-Holzmann-Schule e.V.""",,Johann Philipp Holzmann (1805 - 1870) Mitbegründer der Philipp-Holzmann AG,"Agrarwirtschaft, Bautechnik, Bautechnik / Holztechnik, Farbtechnik und Raumgestaltung, Gartenbau und Floristik, Gebäudereinigung, Holztechnik, Metalltechnik","Anlagenmechaniker/in für Sanitär-, Heizungs- und Klimatechnik, Ausbaufacharbeiter/in, Bauzeichner/in, Dachdecker/in, Fachkraft für Möbel- Küchen- und Umzugsservice, Fahrzeuglackierer/in, Florist/in, Gärtner/in, Gebäudereiniger/in, Hochbaufacharbeiter/in, Holzmechaniker/in, Kanalbauer/in, Maler/in und Lackierer/in, Tiefbaufacharbeiter/in, Tischler/in, Zimmerer/in, Erläuterungen zu den Schulformen",,,https://frankfurt.de/themen/arbeit-bildung-und-wissenschaft/bildung/schulwegweiser/weiterfuehrende-berufliche-schulen/philipp-holzmann-schule,philipp-holzmann-schule,Frankfurt Schulwegweiser,2026-04-06,
SW-rackow-schule-frankfurt,Rackow-Schule Frankfurt (Weiterf. berufl. Schule),Fachoberschule,weiterfuehrende-berufliche-schulen,"Berufliches Gymnasium, Fachoberschule, Gymnasium, Realschule, Weiterführende berufliche Schule",5-13,Eckenheimer Landstraße 303,60320,Frankfurt am Main,Frankfurt am Main,Hessen,Dornbusch,50.1391219,8.6843858,+49 69 552754,+49 69 557763,schulplatz@rackow-frankfurt.de,http://www.rackow-schulen.de,Private Träger,Kolping Bildungswerke,Staatlich anerkannte Ersatzschule,Michael Damm,Manuel Bromkamp (Sekundarstufe 1),570.0,28.0,"8:15-15:30 Uhr, AG Angebot ab 15:45-17:15",,,,,Deutsch,,Englisch,"Französisch, Spanisch, Weitere Sprachangebote, Sonstige Angebote",,"Englisch, Französisch, Spanisch, Weitere Sprachangebote, Sonstige Angebote",,,,,,"""Freunde und Förderer der Rackow-Schulen Frankfurt e.V.""",,"Professor August Rackow, Begründer der ersten Rackow-Schule in Berlin","Sozialwesen, Gesundheit, Wirtschaft und Verwaltung, Wirtschaft - Schwerpunkt Wirtschaft und Verwaltung",,,,https://frankfurt.de/themen/arbeit-bildung-und-wissenschaft/bildung/schulwegweiser/weiterfuehrende-berufliche-schulen/rackow-schule-frankfurt,rackow-schule-frankfurt,Frankfurt Schulwegweiser,2026-04-06,
