STG-18080,Fanny-Leicht-Gymnasium,Gymnasium,Gymnasium,Fanny-Leicht-Straße 13,18080,Stuttgart,Vaihingen,Stuttgart,Baden-Württemberg,48.731165432013846,9.116855353636396,0711 733624,,Poststelle.Fanny-Leicht-Gymnasium@stuttgart.de,http://www.fanny-leicht.de/,,Öffentlich,,,,,,,15,64,Stuttgart-Vaihingen,588,48.7264626,9.1131764,,Stuttgart Österfeld,705,48.7375038,9.1167264,,Stuttgart-Rohr,1618,48.7177263,9.1084072,,Fauststraße,150,48.7319027,9.1151364,,Jurastraße,248,48.7289486,9.1172043,,Vaihingen Viadukt,271,48.7332592,9.1187471,,Fauststraße,138,48.7317796,9.1152171,,Fanny-Leicht-Straße,146,48.72986,9.1170556,,Vaihingen Schillerplatz,394,48.7297365,9.1119447,,"008/043, 042, 751, Flixbus 008",50.0,37,12.3,0,2,35,21,3,23,102,Vaihingen,Stuttgart,3396,7571.9,52.3,0.7,stuttgart.de Adressverzeichnis,2026-04-06,"2024,2023,2022",Unfallatlas,44850,bezirk_estimated,7571.9,24,54.1,339,756.8,175,389.3,60,133.8,6.0,Indian Spice Bazar,"Herrenberger Str. 9, 70563 Stuttgart, Germany",382.0,48.7290649,9.1127362,EDEKA Baisch,"Hauptstraße 5, 70563 Stuttgart, Germany",398.0,48.729646300000006,9.1119469,Frank's Buon Gusto,"Vaihinger Markt 19, 70563 Stuttgart, Germany",411.0,48.730945,9.1112548,20.0,Star Pizza Stuttgart-Vaihingen,"Möhringer Landstraße 29, 70563 Stuttgart, Germany",147.0,48.72994,9.116095,Tsang’s Kitchen Hong Kong Cuisine,"Möhringer Landstraße 11, 70563 Stuttgart, Germany",221.0,48.729903199999995,9.1145278,Maulwurf Kneipe und Bar - Stuttgart,"Möhringer Landstraße 9, 70563 Stuttgart, Germany",254.0,48.729886699999994,9.1139932,5.0,Sehne Ihr Familienbäcker,"Hauptstraße 1, 70563 Stuttgart, Germany",369.0,48.7296704,9.1123565,Backherz,"Hauptstraße 5, 70563 Stuttgart, Germany",397.0,48.7296243,9.1119799,Bäckerei Herz,"Brommerstraße 2, 70563 Stuttgart, Germany",450.0,48.733058199999995,9.1114278,3.0,Haus für Kinder Christus König,"Fanny-Leicht-Straße 33, 70563 Stuttgart, Germany",109.0,48.7305061,9.1179492,"Early Bird Club - Private Krippe, KiTa und Kindergarten in Stuttgart Vaihingen","Möhringer Landstraße 20 - 22, 70563 Stuttgart, Germany",205.0,48.7297077,9.1151552,Evangelischer Kindergarten,"Ernst-Kachel-Straße 9, 70563 Stuttgart, Germany",448.0,48.7319517,9.110865,2.0,Österfeldschule - Außenstelle Liasweg,"Liasweg 4, 70563 Stuttgart, Germany",435.0,48.732845399999995,9.1222118,Österfeldschule,"Katzenbachstraße 27, 70563 Stuttgart, Germany",462.0,48.7327327,9.1110244,Freie Evangelische Schule Stuttgart,"Hengstäcker, Gewann 15, 70567 Stuttgart, Germany",943.0,48.730815,9.1297039,10.0,,,"The Fanny-Leicht-Gymnasium in Stuttgart-Vaihingen is a public general education gymnasium known for its broad educational offerings. The school provides both a linguistic and a STEM (MINT) track in the middle and upper grades, with the profile decision made at the end of 7th grade. In terms of languages, all students learn English as their first foreign language. From grade 6, they can choose between French and Latin as their second foreign language. For students in the linguistic track, there is an option from grade 8 to take Russian or French (if Latin was chosen as the second foreign language) as a third foreign language. Additionally, there is a bilingual track with extra English lessons in the lower grades.

Beyond its academic curriculum, Fanny-Leicht-Gymnasium emphasizes holistic education, encompassing natural sciences, languages, humanities, and cultural aspects. Students can pursue advanced courses (Leistungskurs) in sports and music. School life is enriched by diverse extracurricular activities (AGs) such as basketball, football, climbing, and chess, as well as musical offerings like orchestras, choirs, and bands. Regular concerts and musicals are integral parts of the school year. A unique feature is the 'Treffpunkt Fanny e.V.', an association that forms the heart of school life outside of lessons. Approximately 250 parent volunteers, organized into 24 cooking teams, have been preparing fresh lunch meals daily for the school community since 1989. The school also offers free 'Lernzeit' (study time) to support students.

While the school has a dedicated faculty, reviews have also highlighted challenges such as a long-vacant school leadership position, a partially outdated building, and slow digitalization. The gymnasium is located at Fanny-Leicht-Straße 13, 18080 Stuttgart, and can be contacted by phone at +49 711 7356974 or via email at Fanny-Leicht-Gymnasium@stuttgart.de.","Das Fanny-Leicht-Gymnasium in Stuttgart-Vaihingen ist ein öffentliches allgemeinbildendes Gymnasium, das sich durch ein breites Bildungsangebot auszeichnet. Die Schule bietet in der Mittel- und Oberstufe sowohl einen sprachlichen als auch einen MINT-Zug an, wobei die Entscheidung für ein Profil am Ende der 7. Klasse fällt. Im sprachlichen Bereich lernen alle Schüler Englisch als erste Fremdsprache. Ab Klasse 6 können sie zwischen Französisch und Latein als zweite Fremdsprache wählen. Für Schüler des sprachlichen Zugs besteht ab Klasse 8 die Möglichkeit, Russisch oder Französisch (falls Latein als zweite Fremdsprache gewählt wurde) als dritte Fremdsprache zu belegen. Zusätzlich gibt es einen bilingualen Zug mit zusätzlichem Englischunterricht in den unteren Klassenstufen.

Neben dem akademischen Angebot legt das Fanny-Leicht-Gymnasium großen Wert auf eine ganzheitliche Bildung, die Naturwissenschaften, Sprachen, Geisteswissenschaften und kulturelle Aspekte umfasst. Schüler können Sport und Musik auf Leistungskursniveau belegen. Das Schulleben wird durch vielfältige Arbeitsgemeinschaften wie Basketball, Fußball, Klettern und Schach sowie musikalische Angebote wie Orchester, Chöre und Bands bereichert. Regelmäßige Konzerte und Musicals sind fester Bestandteil des Schuljahres. Ein besonderes Merkmal ist der 'Treffpunkt Fanny e.V.', ein Verein, der das Herzstück des Schullebens außerhalb des Unterrichts bildet. Hier engagieren sich rund 250 Kocheltern in 24 Teams, um seit 1989 täglich frische Mittagsmahlzeiten für die Schulgemeinschaft zuzubereiten. Die Schule bietet zudem eine kostenlose 'Lernzeit' zur Unterstützung der Schüler an.

Obwohl die Schule ein engagiertes Kollegium hat, wurden in Bewertungen auch Herausforderungen wie eine länger vakante Schulleitung, ein teilweise in die Jahre gekommenes Gebäude und eine langsame Digitalisierung genannt. Das Gymnasium ist unter der Adresse Fanny-Leicht-Straße 13, 18080 Stuttgart zu finden und kann telefonisch unter +49 711 7356974 oder per E-Mail unter Fanny-Leicht-Gymnasium@stuttgart.de kontaktiert werden.","Fanny-Leicht-Gymnasium in Stuttgart-Vaihingen is a public gymnasium offering linguistic and STEM tracks. It features English as the first foreign language, followed by French or Latin, and optionally Russian or French as a third language. The school emphasizes holistic education with advanced sports and music courses, diverse extracurricular activities, and a dedicated parent association that prepares fresh lunch meals.","Das Fanny-Leicht-Gymnasium in Stuttgart-Vaihingen ist ein öffentliches Gymnasium mit sprachlichem und MINT-Zug. Es bietet Englisch als erste Fremdsprache, gefolgt von Französisch oder Latein, und optional Russisch oder Französisch als dritte Fremdsprache. Die Schule legt Wert auf eine ganzheitliche Bildung mit Sport- und Musik-Leistungskursen, vielfältigen AGs und einem engagierten Elternverein, der frische Mittagsmahlzeiten zubereitet."
STG-9984,Freie Aktive Schule Stuttgart,Grund- und Werkrealschule,Grund- und Werkrealschule,"Bopseräcker, Gew. 30A",13112,Stuttgart,Sillenbuch,Stuttgart,Baden-Württemberg,48.73454495125221,9.169875270243878,0711 6738238,,sekretariat@fas-stuttgart.de,https://www.stuttgart-inklusiv.de/,,Privat,Gabriele Groß,145.0,,,2001.0,"Reformpädagogik (Montessori, Rebeca Wild), altersgemischte Gruppen, ganzheitliches Lernen, freie Bewegungsentwicklung, Mitbestimmung, Bildungshaus.",7,35,U-Bahn (48.7485),1556,48.748473,9.167888,,U-Bahn (48.7490),1613,48.7490455,9.1694659,,U-Bahn (48.7493),1638,48.7492646,9.1691988,,Peregrinastraße,1294,48.7436853,9.1589438,,Sonnenberg,1381,48.7413446,9.1541136,,Sigmaringer Straße,1382,48.7287206,9.1532295,,Stuttgart Hohe Eiche,134,48.7337979,9.1684386,,Tränke,362,48.7377549,9.1690186,,Bus (48.7370),526,48.7369626,9.1760329,,,50.0,5,1.7,0,0,5,2,2,4,188,Sillenbuch,Stuttgart,1365,5408.5,52.3,0.5,stuttgart.de Adressverzeichnis,2026-04-06,"2024,2023,2022",Unfallatlas,25240,bezirk_estimated,5408.5,10,38.6,136,540.6,70,278.1,24,95.6,1.0,Fanfisch GmbH,"Tränkestraße 13, 70597 Stuttgart, Germany",316.0,48.73639,9.16659,,,,,,,,,,,5.0,Ristorante u. Pizzeria Da Peppone,"Bopseräcker 1, 70597 Stuttgart, Germany",115.0,48.7335213,9.1700839,Clubhaus SV Hoffeld,"Bopseräcker 2, 70597 Stuttgart, Germany",135.0,48.7335833,9.1709935,Rüdiger Spahr Gaststätte,"Bopseräcker 2, 70597 Stuttgart, Germany",137.0,48.73358,9.17104,0.0,,,,,,,,,,,,,,,,0.0,Fröbel-Kindergarten Sigmaringer Straße,"Sigmaringer Str. 119, 70567 Stuttgart, Germany",1042.0,48.732931099999995,9.1558811,Kita Sterntaler,"Epplestraße 221, 70567 Stuttgart, Germany",1062.0,48.7250666,9.168151,Johanniter-Unfall-Hilfe e.V. - Kita Die kleinen Entdecker,"Trochtelfinger Str. 6, 70567 Stuttgart, Germany",1101.0,48.7306258,9.1560909,0.0,Albschule,"Wurmlinger Str. 61, 70597 Stuttgart, Germany",1031.0,48.7428819,9.1637145,Filderschule Degerloch,"Leinfeldener Str. 61, 70597 Stuttgart, Germany",1161.0,48.744984599999995,9.1699571,Riedseeschule,"Sigmaringer Str. 85, 70567 Stuttgart, Germany",1362.0,48.7300944,9.1525689,2.0,,True,"The Freie Aktive Schule Stuttgart (FAS) is a reform pedagogical educational institution that sees itself as an educational house for children and young people, enabling a self-determined educational path. It includes a primary school and, since 2006, also offers the opportunity to attend an associated secondary school, also described as a primary and secondary school with a vocational track. The school places great emphasis on providing students, as actively engaged individuals, with space for free development and supporting them in taking responsibility for their own lives and learning. A central feature of the pedagogical concept is teaching in mixed-age groups, which promotes learning from and with each other. The pedagogical orientation of the Freie Aktive Schule Stuttgart is strongly influenced by the approaches of renowned educators such as Maria Montessori, Rebeca Wild, and Célestin Freinet. The school is privately run and located in Stuttgart-Hoffeld at Bopseräcker 30-33. It offers an alternative educational landscape focused on individual needs and self-directed learning. Further specific data such as the exact number of students and teachers, the languages offered, or the current school leadership are not available from the provided information. The school also regularly seeks support, for example, from federal volunteers.","Die Freie Aktive Schule Stuttgart (FAS) ist eine reformpädagogische Bildungseinrichtung, die sich als Bildungshaus für Kinder und Jugendliche versteht und einen selbstbestimmten Bildungsweg ermöglicht. Sie umfasst eine Grundschule und bietet seit 2006 auch die Möglichkeit, eine zugehörige Realschule zu besuchen, wobei sie auch als Grund- und Hauptschule mit Werkrealschule beschrieben wird. Die Schule legt großen Wert darauf, Schülern als aktiv handelnden Individuen Raum für freie Entfaltung zu geben und sie dabei zu unterstützen, Verantwortung für ihr eigenes Leben und Lernen zu übernehmen. Ein zentrales Merkmal des pädagogischen Konzepts ist der Unterricht in altersgemischten Gruppen, der das Lernen voneinander und miteinander fördert. Die pädagogische Ausrichtung der Freien Aktiven Schule Stuttgart ist stark von den Ansätzen bekannter Pädagogen wie Maria Montessori, Rebeca Wild und Célestin Freinet geprägt. Die Schule befindet sich in privater Trägerschaft und ist in Stuttgart-Hoffeld unter der Adresse Bopseräcker 30-33 zu finden. Sie bietet eine alternative Bildungslandschaft, die auf individuelle Bedürfnisse und selbstgesteuertes Lernen ausgerichtet ist. Weitere spezifische Daten wie die genaue Anzahl der Schüler und Lehrkräfte, die angebotenen Sprachen oder die aktuelle Schulleitung sind aus den verfügbaren Informationen nicht ersichtlich. Die Schule sucht zudem regelmäßig Unterstützung, beispielsweise durch Bundesfreiwilligendienstleistende.","The Freie Aktive Schule Stuttgart (FAS) is a private reform pedagogical educational institution with primary and secondary schools in Stuttgart-Hoffeld. It promotes self-determined learning in mixed-age groups, based on pedagogical approaches by Montessori, Wild, and Freinet. The school enables students to develop freely and take responsibility for their educational path.","Die Freie Aktive Schule Stuttgart (FAS) ist eine private reformpädagogische Bildungseinrichtung mit Grund- und Realschule in Stuttgart-Hoffeld. Sie fördert selbstbestimmtes Lernen in altersgemischten Gruppen, basierend auf pädagogischen Ansätzen von Montessori, Wild und Freinet. Die Schule ermöglicht Schülern eine freie Entfaltung und die Übernahme von Verantwortung für ihren Bildungsweg."
STG-270401,Freie element-i Gemeinschaftschule in Stuttgart,Gemeinschaftsschule,Gemeinschaftsschule,Breitwiesenstraße 8,27040,Stuttgart,Möhringen,Stuttgart,Baden-Württemberg,48.72229741281448,9.123483503538356,0711 6569601010,,schule@element-i.de,https://www.element-i.de/,,Privat,,65.0,,Englisch,,"STEM focus (digitalisation, AI), bilingual concept, mixed-age learning groups, arts and culture engagement.",21,59,Stuttgart-Vaihingen,887,48.7264626,9.1131764,,Stuttgart-Rohr,1217,48.7177263,9.1084072,,U-Bahn (48.7175),1406,48.7174685,9.1411963,,Lapp Kabel,191,48.7228799,9.1210289,,Dürrlewang,509,48.7193705,9.1181455,,Wallgraben,535,48.7270363,9.1247795,,Gewerbestraße,182,48.7218683,9.1210865,,Gewerbestraße (Lapp Kabel),184,48.7218281,9.1210847,,Berufsbildungszentrum,184,48.7239146,9.1229705,,,50.0,27,9.0,0,1,26,9,1,21,175,Möhringen,Stuttgart,2461,7571.9,52.3,0.7,stuttgart.de Adressverzeichnis,2026-04-06,"2024,2023,2022",Unfallatlas,32500,bezirk_estimated,7571.9,18,54.1,246,756.8,127,389.3,43,133.8,3.0,Primavera Snacks Getränke und Snacks,"Handwerkstraße 58, 70565 Stuttgart, Germany",243.0,48.7205062,9.1215883,ALDI SÜD,"Galileistraße 7, 70565 Stuttgart, Germany",247.0,48.721525,9.120326000000002,JET Tankstelle,"Industriestraße 38, 70565 Stuttgart, Germany",361.0,48.7242,9.1195,10.0,Burger King Stuttgart,"Industriestraße 58, 70565 Stuttgart, Germany",173.0,48.7231355,9.1254644,Canteen B19 of Stollsteimer Catering & Events,"Breitwiesenstraße 19, 70565 Stuttgart, Germany",316.0,48.721979700000006,9.1277577,TC Blau-Weiss Vaihingen-Rohr,"Heßbrühlstraße 64, 70565 Stuttgart, Germany",339.0,48.722226,9.1188672,5.0,Bäckerei Stuttgart - Keim,"Industriestraße 57, 70565 Stuttgart, Germany",249.0,48.7238475,9.1259423,Chicco di caffè - Mercedes-Benz AG Office V,"Am Wallgraben 114, 70565 Stuttgart, Germany",293.0,48.7246584,9.1216964,JET Tankstelle,"Industriestraße 38, 70565 Stuttgart, Germany",361.0,48.7242,9.1195,2.0,IB-Kita Vaihinger Zwerge,"Schulze-Delitzsch-Straße 39, 70565 Stuttgart, Germany",305.0,48.7207819,9.1269431,sternchen Vaihingen - pme Familienservice,"Industriestraße 29, 70565 Stuttgart, Germany",383.0,48.7247071,9.1197565,MOSAIK Kita,"Heßbrühlstraße 38, 70565 Stuttgart, Germany",622.0,48.723287199999994,9.1151419,0.0,Schönbuchschule,"Dürrlewangstraße 20, 70565 Stuttgart, Germany",946.0,48.7169141,9.1135048,Freie Evangelische Schule Stuttgart,"Hengstäcker, Gewann 15, 70567 Stuttgart, Germany",1051.0,48.730815,9.1297039,Bodelschwinghschule,"Hengstäcker 3, 70567 Stuttgart, Germany",1111.0,48.7316958,9.1286183,6.0,111.0,True,"The Freie element-i Gemeinschaftsschule in Stuttgart is a state-recognized private school operated by element-i, distinguished by its innovative and individualized pedagogical concept. Located at Breitwiesenstraße 8, 70565 Stuttgart-Vaihingen, the school is open Monday to Friday from 7:30 AM to 5:30 PM, with only 25 closing days per year. Currently, 65 students attend the institution. A core pillar of the element-i pedagogy is fostering individual interests and talents in mixed-age, cross-grade learning groups, allowing for self-paced learning. 

The school places a strong emphasis on future-oriented STEM topics, particularly digitalization and artificial intelligence, while also integrating arts and culture into the curriculum. The bilingual concept, with English as one of the languages, specifically supports children from international families and gifted students by adapting learning content to their individual knowledge levels. Facilities include a 300 square meter exercise room. 

The Freie element-i Gemeinschaftsschule Stuttgart was founded in 2021 and is part of a planned element-i education center in Ruppmannstraße, Stuttgart-Vaihingen, which will eventually unite a childcare center, primary school, and upper-level secondary school under one roof. Monthly costs consist of school fees (111 Euros) and optional services such as afternoon and holiday care (161 Euros) and full catering (151 Euros). Siblings receive discounts, and scholarships are awarded.","Die Freie element-i Gemeinschaftsschule in Stuttgart ist eine staatlich anerkannte Privatschule in Trägerschaft von element-i, die sich durch ein innovatives und individualisiertes pädagogisches Konzept auszeichnet. Die Schule befindet sich in der Breitwiesenstraße 8, 70565 Stuttgart-Vaihingen, und ist montags bis freitags von 7:30 Uhr bis 17:30 Uhr geöffnet, mit lediglich 25 Schließtagen im Jahr. Aktuell besuchen 65 Schüler die Einrichtung. Ein zentraler Pfeiler der element-i Pädagogik ist die Förderung individueller Interessen und Talente der Schüler in altersgemischten und jahrgangsübergreifenden Lerngruppen, die ein selbstbestimmtes Lerntempo ermöglichen. 

Die Schule legt einen starken Fokus auf zukunftsrelevante MINT-Themen, insbesondere Digitalisierung und Künstliche Intelligenz, und integriert gleichzeitig Kunst und Kultur in den Lehrplan. Das bilinguale Konzept, mit Englisch als einer der Sprachen, unterstützt insbesondere Kinder aus internationalen Familien und hochbegabte Schüler durch eine Anpassung der Lerninhalte an deren individuellen Kenntnisstand. Zur Ausstattung gehört ein 300 Quadratmeter großer Bewegungsraum. 

Die Freie element-i Gemeinschaftsschule Stuttgart wurde 2021 gegründet und ist Teil eines geplanten element-i Bildungshauses in der Ruppmannstraße in Stuttgart-Vaihingen, das zukünftig auch eine Kita, eine Grundschule und eine gymnasiale Oberstufe unter einem Dach vereinen wird. Die monatlichen Kosten setzen sich aus Schulgebühren (111 Euro) und optionalen Leistungen wie Nachmittags- und Ferienbetreuung (161 Euro) sowie Vollverpflegung (151 Euro) zusammen. Geschwisterkinder erhalten Ermäßigungen, und es werden Stipendien vergeben.","The Freie element-i Gemeinschaftsschule Stuttgart is a private, state-recognized secondary school with 65 students, founded in 2021. It offers a bilingual concept with English, mixed-age learning groups, and a strong STEM focus on digitalization and AI, complemented by arts and culture promotion. The school is open from 7:30 AM to 5:30 PM and is part of a future education center.","Die Freie element-i Gemeinschaftsschule Stuttgart ist eine private, staatlich anerkannte Sekundarschule mit 65 Schülern, die 2021 gegründet wurde. Sie bietet ein bilinguales Konzept mit Englisch, altersgemischte Lerngruppen und einen starken MINT-Fokus auf Digitalisierung und KI, ergänzt durch Kunst- und Kulturförderung. Die Schule ist von 7:30 bis 17:30 Uhr geöffnet und Teil eines zukünftigen Bildungshauses."
