STG-17760,Pestalozzischule,Grund- und Werkrealschule,Grund- und Werkrealschule,Krehlstraße 60,17760,Stuttgart,Vaihingen,Stuttgart,Baden-Württemberg,48.72398394177479,9.100590340569184,0711 21698660,,poststelle.pestalozzischule@stuttgart.de,https://www.stuttgart-inklusiv.de/,,Öffentlich,Silke Plaas,,33.0,,1945.0,"Weltethosschule, Berufswahlsiegel, Partnerschule in Afrika, BiSS Transfer BW, Erlebnispädagogik, Schulsozialarbeit, Musik für Alle, Präventionsprogramme.",11,59,Stuttgart-Rohr,902,48.7177263,9.1084072,,Stuttgart-Vaihingen,963,48.7264626,9.1131764,,Stuttgart Österfeld,1913,48.7375038,9.1167264,,Vaihingen,866,48.7262981,9.1118577,,Vaihingen Schillerplatz,1137,48.7301395,9.1129629,,Jurastraße,1331,48.7289227,9.1171158,,Pestalozzi Schule,120,48.7250408,9.1002513,,Pestalozzi-Schule,129,48.725128,9.100332,,Albblick,410,48.7238436,9.0950076,,"008/043, 042, 751, Flixbus 008",50.0,23,7.7,0,1,22,13,7,18,81,Vaihingen,Stuttgart,3396,7571.9,52.3,0.7,stuttgart.de Adressverzeichnis,2026-04-06,"2024,2023,2022",Unfallatlas,44850,bezirk_estimated,7571.9,24,54.1,339,756.8,175,389.3,60,133.8,2.0,Feinkost Waldburg,"Waldburgstraße 33, 70563 Stuttgart, Germany",419.0,48.7251266,9.1060314,Frischemarkt Waldburg,"Waldburgstraße 33, 70563 Stuttgart, Germany",420.0,48.7251603,9.1060275,,,,,,1.0,Bäckerhaus Veit Café,"Robert-Koch-Straße 65, 70563 Stuttgart, Germany",481.0,48.72448,9.10711,,,,,,,,,,,1.0,Bäckerhaus Veit Café,"Robert-Koch-Straße 65, 70563 Stuttgart, Germany",481.0,48.72448,9.10711,,,,,,,,,,,3.0,Tageseinrichtung für Kinder Krehlstraße,"Rohr, 70565 Stuttgart, Germany",231.0,48.7220243,9.1016284,Die Kleinen Feuerdrachen,"Stadtbad, Stadtbad, Freibadstraße 30, 70563 Stuttgart, Germany",435.0,48.7275441,9.103042,Tageseinrichtung für Kinder Freibadstraße 86,"Freibadstraße 86, 70563 Stuttgart, Germany",453.0,48.727098999999995,9.0966184,1.0,Albert-Schweitzer-Schule Stuttgart,"Thingstraße 50, 70565 Stuttgart, Germany",458.0,48.721494199999995,9.0956243,Griechische Schule Vaihingen e.V.,"Schwabenpl. 3, 70563 Stuttgart, Germany",978.0,48.7310465,9.1085369,Schönbuchschule,"Dürrlewangstraße 20, 70565 Stuttgart, Germany",1231.0,48.7169141,9.1135048,7.0,,,"Pestalozzischule Stuttgart is a partially full-day primary school with an integrated secondary school (Werkrealschule) and preparatory classes, conceived as a comprehensive learning and living environment. Founded in 1945, the school has evolved into a modern educational institution with 33 teachers. Under the leadership of Principal Silke Plaas and Vice-Principal Martin Brenken, the school places great emphasis on character development and prevention. 

In the primary school section, Pestalozzischule has offered both half-day and full-day models since the 2015/16 school year, with separate half-day and two full-day classes being implemented from 2022/23. The full-day program consists of four days a week with eight hours each and one day with 4.5 hours. The one- to two-stream secondary school is characterized by a targeted strengthening of basic competencies, practical teaching methods, and a strong focus on career orientation. Instruction primarily takes place at the basic level (G-Niveau) in fixed class groups, with the class teacher principle fostering a trusting relationship between teachers and students. 

Among the special features of Pestalozzischule are its distinctions as a 'Weltethosschule' (World Ethics School) and a recipient of the 'Berufswahlsiegel' (Career Choice Seal). It is involved in a partnership with a school in Africa and participates in programs such as BiSS Transfer BW. The educational offerings are complemented by experiential education, school social work, the 'Musik für Alle' (Music for All) project, and special support programs like 'Textprofi' to improve reading and writing skills, LRS support in grades 5 and 6, and 'QuaMath' to strengthen mathematical understanding. High-achieving students are supported in 'Championstunden'. The school is excellently equipped digitally with displays, iPads, and laptops, offering media education and computer science from grade 5. A student café for grades 7-10 and regular events such as the career fair and the World Ethics Week enrich school life.","Die Pestalozzischule Stuttgart ist eine teilgebundene Ganztagesgrundschule mit angeschlossener Werkrealschule und Vorbereitungsklassen, die sich als umfassenden Lern- und Lebensraum versteht. Seit ihrer Gründung im Jahr 1945 hat sich die Schule zu einer modernen Bildungseinrichtung entwickelt, die derzeit 33 Lehrkräfte beschäftigt. Unter der Leitung von Rektorin Silke Plaas und Konrektor Martin Brenken legt die Schule großen Wert auf Persönlichkeitsbildung und Prävention. 

Im Grundschulbereich bietet die Pestalozzischule seit dem Schuljahr 2015/16 sowohl Halbtags- als auch Ganztagsmodelle an, wobei ab 2022/23 separate Halbtags- und zwei Ganztagsklassen geführt werden. Das Ganztagsangebot umfasst vier Tage pro Woche mit jeweils acht Stunden und einen Tag mit 4,5 Stunden. Die ein- bis zweizügige Werkrealschule zeichnet sich durch eine gezielte Stärkung der Basiskompetenzen, praxisnahe Unterrichtsgestaltung und eine ausgeprägte Berufsorientierung aus. Der Unterricht findet vorwiegend im grundlegenden Niveau (G-Niveau) in festen Klassenverbänden statt, wobei das Klassenlehrerprinzip eine vertrauensvolle Beziehung zwischen Lehrkräften und Schülern fördert. 

Zu den besonderen Merkmalen der Pestalozzischule gehören ihre Auszeichnungen als Weltethosschule und Träger des Berufswahlsiegels. Sie engagiert sich in einer Partnerschaft mit einer Schule in Afrika und nimmt an Programmen wie BiSS Transfer BW teil. Das pädagogische Angebot wird durch Erlebnispädagogik, Schulsozialarbeit, das Projekt „Musik für Alle“ sowie spezielle Förderprogramme wie „Textprofi“ zur Verbesserung der Lese- und Schreibkompetenz, LRS-Förderung in den Klassen 5 und 6, und „QuaMath“ zur Stärkung des mathematischen Verständnisses ergänzt. Leistungsstärkere Schüler werden in „Championstunden“ gefördert. Die Schule ist digital hervorragend ausgestattet mit Displays, iPads und Laptops und bietet ab Klasse 5 Medienbildung und Informatik an. Ein Schülercafé für die Klassen 7-10 und regelmäßige Veranstaltungen wie die Ausbildungsmesse und die Weltethoswoche bereichern das Schulleben.","Pestalozzischule Stuttgart is a partially full-day primary school with a secondary school and preparatory classes, founded in 1945 with 33 teachers. It emphasizes character development, career orientation, and digital education, supported by programs like 'Weltethosschule,' 'Berufswahlsiegel,' and 'Musik für Alle.' The school offers both half-day and full-day models and provides targeted student support in various areas.","Die Pestalozzischule Stuttgart ist eine teilgebundene Ganztagesgrundschule mit Werkrealschule und Vorbereitungsklassen, die 1945 gegründet wurde und 33 Lehrkräfte beschäftigt. Sie legt Wert auf Persönlichkeitsbildung, Berufsorientierung und digitale Bildung, unterstützt durch Programme wie „Weltethosschule“, „Berufswahlsiegel“ und „Musik für Alle“. Die Schule bietet sowohl Halbtags- als auch Ganztagsmodelle an und fördert Schüler gezielt in verschiedenen Bereichen."
STG-17995,Raichberg-Realschule,Realschule,Realschule,Schönbühlstraße 90,17995,Stuttgart,Ost,Stuttgart,Baden-Württemberg,48.78321027127038,9.209939047278144,0711 21633550,,Poststelle.Raichberg-Realschule@stuttgart.de,https://www.stuttgart-inklusiv.de/,,Öffentlich,Beate Vöhringer,400.0,30.0,,,"sozial-musisches Profil, RAIKO-Angebot, Schule ohne Rassismus",6,20,Bad Cannstatt,2086,48.8014069,9.2168515,,Schlossplatz,2298,48.7791984,9.1791684,,Eingang Rathaus (U-Bahn),2370,48.774433,9.1804719,,Gaisburg,418,48.7839051,9.2155437,,Raitelsberg,660,48.7889458,9.2122835,,Schlachthof,714,48.7871649,9.2176171,,Tal-/Landhausstraße,320,48.7846571,9.2137173,,Raitelsberg,645,48.7888289,9.2121413,,Bus (48.7866),684,48.7866295,9.2177024,,,50.0,78,26.0,0,7,71,27,15,48,70,Ost,Stuttgart,5857,11898.7,52.3,1.1,stuttgart.de Adressverzeichnis,2026-04-06,"2024,2023,2022",Unfallatlas,49220,bezirk_estimated,11898.7,42,85.0,585,1189.2,301,611.8,104,210.3,10.0,Select,"70188 Stuttgart, Germany",101.0,48.7824897,9.2107769,REWE Stephanie Güntner,"Ostendstraße 90, 70188 Stuttgart, Germany",171.0,48.7831374,9.207603,REWE,"Ostendstraße 75, 70188 Stuttgart, Germany",225.0,48.7848018,9.2080524,20.0,Ciao Claus Café & Bar,"Ostendstraße 84, 70188 Stuttgart, Germany",183.0,48.7837985,9.2075999,l´Ulivo,"Stuifenstraße 28, 70188 Stuttgart, Germany",201.0,48.7839967,9.2074662,Kulturwerk - öffentliche Kantine,"Ostendstraße 106A, 70188 Stuttgart, Germany",237.0,48.782118999999994,9.207159,19.0,Shell,"Talstraße 28, 70188 Stuttgart, Germany",90.0,48.782557,9.210672,Café117,"Ostendstraße 117, 70188 Stuttgart, Germany",179.0,48.7820453,9.2082552,Rössle,"Ostendstraße 82, 70188 Stuttgart, Germany",209.0,48.7842904,9.2075983,7.0,Evangelischer Kindergarten Klingenbach,"Schönbühlstraße 83, 70188 Stuttgart, Germany",170.0,48.783197300000005,9.2122625,Kinder- und Familienzentrum Landhausstraße (KiFaZ),"Landhausstraße 188/1, 70188 Stuttgart, Germany",186.0,48.784861199999995,9.2103091,Kindertagesstätte Gaisburg,"Schönbühlstraße 100, 70188 Stuttgart, Germany",186.0,48.7825954,9.2123069,1.0,Grund- und Werkrealschule Gablenberg,"Pflasteräckerstraße 25, 70186 Stuttgart, Germany",395.0,48.77979,9.20848,Grundschule Gaisburg,"Landhausstraße 255, 70188 Stuttgart, Germany",571.0,48.7835354,9.2177136,Elementary and Werkrealschule Ostheim,"Landhausstraße 117, 70190 Stuttgart, Germany",758.0,48.7878406,9.202342,13.0,,,"The Raichberg-Realschule in Stuttgart is a public secondary school distinguished by its strong socio-musical profile. Located at Schönbühlstraße 90, 17995 Stuttgart, it provides comprehensive education to approximately 400 students. The faculty comprises about 30 dedicated teachers committed to fostering their students' development. A unique feature of the school is its RAIKO program, which offers students diverse opportunities for musical and social growth. The school places great emphasis on an inclusive and respectful community, reflected in its designation as a 'School without Racism – School with Courage.' Under the leadership of Head of School Beate Vöhringer, an environment is created that promotes both academic achievement and personal development. While no specific foreign language specializations were mentioned, it is assumed that the school offers the standard foreign languages of the Realschule curriculum. The founding year of the school is not available. The Raichberg-Realschule strives to prepare its students for future challenges and provide them with a solid foundation for their further educational and life paths, with a focus on musical education and social responsibility. The school integrates these values into its daily lessons and extracurricular activities to ensure holistic development. Its commitment to social justice and musical promotion makes the Raichberg-Realschule a distinctive educational institution in Stuttgart.","Die Raichberg-Realschule in Stuttgart ist eine öffentliche weiterführende Schule, die sich durch ein ausgeprägtes sozial-musikalisches Profil auszeichnet. Gelegen in der Schönbühlstraße 90, 17995 Stuttgart, bietet sie rund 400 Schülern eine umfassende Bildung. Das Kollegium besteht aus etwa 30 engagierten Lehrkräften, die sich der Förderung ihrer Schüler widmen. Ein besonderes Merkmal der Schule ist das RAIKO-Angebot, welches den Schülern vielfältige Möglichkeiten zur musikalischen und sozialen Entfaltung bietet. Die Schule legt großen Wert auf ein inklusives und respektvolles Miteinander, was sich in ihrer Auszeichnung als „Schule ohne Rassismus – Schule mit Courage“ widerspiegelt. Unter der Leitung von Schulleiterin Beate Vöhringer wird ein Umfeld geschaffen, das sowohl akademische Leistungen als auch die persönliche Entwicklung der Schüler fördert. Obwohl keine spezifischen Fremdsprachenschwerpunkte genannt wurden, ist davon auszugehen, dass die Schule die üblichen Fremdsprachen des Realschulcurriculums anbietet. Das Gründungsjahr der Schule ist nicht bekannt. Die Raichberg-Realschule ist bestrebt, ihre Schüler auf zukünftige Herausforderungen vorzubereiten und ihnen eine solide Grundlage für ihren weiteren Bildungs- und Lebensweg zu vermitteln, wobei der Fokus auf musischer Bildung und sozialer Verantwortung liegt. Die Schule integriert diese Werte in ihren täglichen Unterricht und ihre außerschulischen Aktivitäten, um eine ganzheitliche Entwicklung zu gewährleisten. Das Engagement für soziale Gerechtigkeit und musikalische Förderung macht die Raichberg-Realschule zu einer besonderen Bildungseinrichtung in Stuttgart.","The Raichberg-Realschule in Stuttgart is a public secondary school with approximately 400 students and 30 teachers. It is characterized by a socio-musical profile, the RAIKO program, and its designation as a 'School without Racism.' Led by Beate Vöhringer, the school promotes the comprehensive development of its students.","Die Raichberg-Realschule in Stuttgart ist eine öffentliche Realschule mit rund 400 Schülern und 30 Lehrkräften. Sie zeichnet sich durch ein sozial-musikalisches Profil, das RAIKO-Angebot und die Auszeichnung als „Schule ohne Rassismus“ aus. Unter der Leitung von Beate Vöhringer fördert die Schule eine umfassende Entwicklung ihrer Schüler."
STG-17981,Realschule Ostheim,Realschule,Realschule,Landhausstraße 117,17981,Stuttgart,Ost,Stuttgart,Baden-Württemberg,48.787396515786334,9.203176688424945,0711 21633301,,poststelle.realschule.ostheim@stuttgart.de,https://www.rsostheim.de/,,Öffentlich,Julia Habel,290.0,27.0,"Englisch, Französisch",1976.0,"Berufsorientierung, Integration der Kulturen durch Dialog, Sprache und Kommunikation, Selbstorganisiertes Lernen, Digitale Medien",0,8,Bad Cannstatt,1852,48.8014069,9.2168515,,Schlossplatz,1981,48.7791984,9.1791684,,Stuttgart Nordbahnhof,2127,48.80373,9.188064,,Raitelsberg,689,48.7889458,9.2122835,,Gaisburg,986,48.7839051,9.2155437,,Schlachthof,1058,48.7871649,9.2176171,,Raitelsberg,676,48.7888289,9.2121413,,Tal-/Landhausstraße,830,48.7846571,9.2137173,,Schlachthof,1049,48.7870787,9.2174933,,,16.0,58,19.3,0,4,54,25,9,38,90,Ost,Stuttgart,5857,11898.7,52.3,1.1,stuttgart.de Adressverzeichnis,2026-04-06,"2024,2023,2022",Unfallatlas,49220,bezirk_estimated,11898.7,42,85.0,585,1189.2,301,611.8,104,210.3,5.0,Aryana Markt,"Hackstraße 37, 70190 Stuttgart, Germany",219.0,48.7893102,9.2024517,PENNY,"Haußmannstraße 103, 70188 Stuttgart, Germany",310.0,48.7855427,9.2000218,Gesunde Kost Rein e.K.,"Landhausstraße 166, 70188 Stuttgart, Germany",320.0,48.7860483,9.2070328,20.0,Time For Sushi,"Landhausstraße 110, 70190 Stuttgart, Germany",95.0,48.787448399999995,9.201883900000002,Udo Snack,"Schwarenbergstraße 40, 70190 Stuttgart, Germany",122.0,48.7880516,9.2018404,Pizzeria Palma,"Hackstraße 41, 70190 Stuttgart, Germany",216.0,48.789310099999994,9.2027014,15.0,Rosticceria Palma,"Landhausstraße 113A, 70190 Stuttgart, Germany",121.0,48.7878165,9.201652,Kafenio-Hellas,"Haußmannstraße 137, 70188 Stuttgart, Germany",191.0,48.785697899999995,9.2035768,Petty's Backhaus,"Hackstraße 39, 70190 Stuttgart, Germany",219.0,48.7893169,9.2024918,4.0,Kindergarten Staibenäcker,"Staibenäcker 8, 70188 Stuttgart, Germany",343.0,48.78432,9.2029401,Apfelbäumchen,"Rotenbergstraße 83, 70190 Stuttgart, Germany",345.0,48.7874646,9.2078807,Evang. Kindertagesstätte Stöckach,"Sickstraße 39, 70190 Stuttgart, Germany",398.0,48.7908196,9.2047776,0.0,Ameisenbergschule,"Ameisenbergstraße 2, 70188 Stuttgart, Germany",749.0,48.7840385,9.1943142,Grund- und Werkrealschule Gablenberg,"Pflasteräckerstraße 25, 70186 Stuttgart, Germany",931.0,48.77979,9.20848,Raitelsbergschule,"Röntgenstraße 5, 70190 Stuttgart, Germany",941.0,48.7915212,9.214397,12.0,,,"Realschule Ostheim, founded in 1976, is a public secondary school located at Landhausstraße 117 in Stuttgart. Under the leadership of Julia Habel, it provides comprehensive education to approximately 290 students, supported by a dedicated faculty of 27 teachers. As a Realschule, it lays the foundation for vocational careers and further academic education. A particular focus is placed on career orientation to best prepare students for their future. The school actively promotes the integration of cultures through dialogue, language, and communication, fostering an inclusive and diverse learning environment. English and French are offered as foreign languages, strengthening students' linguistic competencies. Pedagogical approaches such as self-organized learning and the targeted use of digital media are firmly integrated into daily school life to develop self-reliance and future-oriented skills. Realschule Ostheim sees itself as a modern educational institution that prepares its students not only academically but also personally and socially for the challenges of a globalized world.","Die Realschule Ostheim, gegründet im Jahr 1976, ist eine öffentliche weiterführende Schule in Stuttgart, gelegen in der Landhausstraße 117. Unter der Leitung von Julia Habel bietet sie rund 290 Schülern eine umfassende Bildung, die von einem engagierten Kollegium von 27 Lehrkräften vermittelt wird. Als Realschule legt sie den Grundstein für berufliche Laufbahnen und weiterführende schulische Bildung. Ein besonderer Schwerpunkt liegt auf der Berufsorientierung, um die Schüler bestmöglich auf ihre Zukunft vorzubereiten. Die Schule fördert aktiv die Integration der Kulturen durch Dialog, Sprache und Kommunikation, was ein inklusives und vielfältiges Lernumfeld schafft. Im Unterricht werden Englisch und Französisch als Fremdsprachen angeboten, wodurch die sprachlichen Kompetenzen der Schüler gestärkt werden. Pädagogische Ansätze wie selbstorganisiertes Lernen und der gezielte Einsatz digitaler Medien sind fest im Schulalltag verankert, um Eigenverantwortung und zukunftsorientierte Fähigkeiten zu entwickeln. Die Realschule Ostheim versteht sich als eine moderne Bildungseinrichtung, die ihre Schüler nicht nur fachlich, sondern auch persönlich und sozial auf die Herausforderungen einer globalisierten Welt vorbereitet.","Realschule Ostheim in Stuttgart, founded in 1976, is a public secondary school with 290 students and 27 teachers. It focuses on career orientation, cultural integration, self-organized learning, and digital media, offering English and French as foreign languages. Led by Julia Habel, it comprehensively prepares students for their future.","Die Realschule Ostheim in Stuttgart ist eine 1976 gegründete öffentliche Realschule mit 290 Schülern und 27 Lehrkräften. Sie legt Schwerpunkte auf Berufsorientierung, kulturelle Integration, selbstorganisiertes Lernen und digitale Medien, und bietet Englisch sowie Französisch als Fremdsprachen an. Geleitet von Julia Habel, bereitet sie Schüler umfassend auf ihre Zukunft vor."
