schulnummer,schulname,school_type,schulart,strasse,plz,ort,ortsteil,stadt,bundesland,latitude,longitude,telefon,fax,email,website,schulleitung,traegerschaft,leitung,schueler_2024_25,lehrer_2024_25,sprachen,gruendungsjahr,besonderheiten,transit_stops_500m,transit_stop_count_1000m,transit_rail_01_name,transit_rail_01_distance_m,transit_rail_01_latitude,transit_rail_01_longitude,transit_rail_01_lines,transit_rail_02_name,transit_rail_02_distance_m,transit_rail_02_latitude,transit_rail_02_longitude,transit_rail_02_lines,transit_rail_03_name,transit_rail_03_distance_m,transit_rail_03_latitude,transit_rail_03_longitude,transit_rail_03_lines,transit_tram_01_name,transit_tram_01_distance_m,transit_tram_01_latitude,transit_tram_01_longitude,transit_tram_01_lines,transit_tram_02_name,transit_tram_02_distance_m,transit_tram_02_latitude,transit_tram_02_longitude,transit_tram_02_lines,transit_tram_03_name,transit_tram_03_distance_m,transit_tram_03_latitude,transit_tram_03_longitude,transit_tram_03_lines,transit_bus_01_name,transit_bus_01_distance_m,transit_bus_01_latitude,transit_bus_01_longitude,transit_bus_01_lines,transit_bus_02_name,transit_bus_02_distance_m,transit_bus_02_latitude,transit_bus_02_longitude,transit_bus_02_lines,transit_bus_03_name,transit_bus_03_distance_m,transit_bus_03_latitude,transit_bus_03_longitude,transit_bus_03_lines,transit_all_lines_1000m,transit_accessibility_score,traffic_accidents_total,traffic_accidents_per_year,traffic_accidents_fatal,traffic_accidents_serious,traffic_accidents_minor,traffic_accidents_bicycle,traffic_accidents_pedestrian,traffic_accidents_school_hours,traffic_nearest_accident_m,crime_bezirk,crime_stadt,crime_straftaten_2023,crime_haeufigkeitszahl_2023,crime_aufklaerungsquote_2023,crime_bezirk_index,data_source,data_retrieved,traffic_data_years,traffic_data_source,crime_bezirk_population,crime_data_source,crime_straftaten_2023_rate_per_100k,crime_strassenraub_2023,crime_strassenraub_2023_rate_per_100k,crime_koerperverletzung_2023,crime_koerperverletzung_2023_rate_per_100k,crime_diebstahl_fahrrad_2023,crime_diebstahl_fahrrad_2023_rate_per_100k,crime_wohnungseinbruch_2023,crime_wohnungseinbruch_2023_rate_per_100k,poi_supermarket_count_500m,poi_supermarket_01_name,poi_supermarket_01_address,poi_supermarket_01_distance_m,poi_supermarket_01_latitude,poi_supermarket_01_longitude,poi_supermarket_02_name,poi_supermarket_02_address,poi_supermarket_02_distance_m,poi_supermarket_02_latitude,poi_supermarket_02_longitude,poi_supermarket_03_name,poi_supermarket_03_address,poi_supermarket_03_distance_m,poi_supermarket_03_latitude,poi_supermarket_03_longitude,poi_restaurant_count_500m,poi_restaurant_01_name,poi_restaurant_01_address,poi_restaurant_01_distance_m,poi_restaurant_01_latitude,poi_restaurant_01_longitude,poi_restaurant_02_name,poi_restaurant_02_address,poi_restaurant_02_distance_m,poi_restaurant_02_latitude,poi_restaurant_02_longitude,poi_restaurant_03_name,poi_restaurant_03_address,poi_restaurant_03_distance_m,poi_restaurant_03_latitude,poi_restaurant_03_longitude,poi_bakery_cafe_count_500m,poi_bakery_cafe_01_name,poi_bakery_cafe_01_address,poi_bakery_cafe_01_distance_m,poi_bakery_cafe_01_latitude,poi_bakery_cafe_01_longitude,poi_bakery_cafe_02_name,poi_bakery_cafe_02_address,poi_bakery_cafe_02_distance_m,poi_bakery_cafe_02_latitude,poi_bakery_cafe_02_longitude,poi_bakery_cafe_03_name,poi_bakery_cafe_03_address,poi_bakery_cafe_03_distance_m,poi_bakery_cafe_03_latitude,poi_bakery_cafe_03_longitude,poi_kita_count_500m,poi_kita_01_name,poi_kita_01_address,poi_kita_01_distance_m,poi_kita_01_latitude,poi_kita_01_longitude,poi_kita_02_name,poi_kita_02_address,poi_kita_02_distance_m,poi_kita_02_latitude,poi_kita_02_longitude,poi_kita_03_name,poi_kita_03_address,poi_kita_03_distance_m,poi_kita_03_latitude,poi_kita_03_longitude,poi_primary_school_count_500m,poi_primary_school_01_name,poi_primary_school_01_address,poi_primary_school_01_distance_m,poi_primary_school_01_latitude,poi_primary_school_01_longitude,poi_primary_school_02_name,poi_primary_school_02_address,poi_primary_school_02_distance_m,poi_primary_school_02_latitude,poi_primary_school_02_longitude,poi_primary_school_03_name,poi_primary_school_03_address,poi_primary_school_03_distance_m,poi_primary_school_03_latitude,poi_primary_school_03_longitude,poi_secondary_school_count_500m,tuition_monthly_eur,scholarship_available,description,description_de,summary_en,summary_de
STG-18520,Albertus-Magnus-Gymnasium,Gymnasium,Gymnasium,In den Ringelgärten 90,18520,Stuttgart,Bad Cannstatt,Stuttgart,Baden-Württemberg,48.81604436146871,9.246814264974043,0711 5307636,,mail@vw.amgs.de,http://www.amgs.de/,,Öffentlich,Georg Braun,700.0,65.0,"Englisch, Französisch, Latein, Spanisch",1983.0,"Marchtaler Plan, Musik (Streicher-/Gesangsklasse), Sportpartnerschaften, DELF, MINT, Theater AG, Ganztagsbetreuung",10,20,Sommerrain,154,48.8152317,9.248517,,Fellbach,1817,48.820297,9.2707765,,Stuttgart Neckarpark,2726,48.7918161,9.2411731,,Beskidenstraße,836,48.8102154,9.2540306,,Antwerpener Straße,885,48.8084538,9.2431757,,Höhenstraße,1246,48.8118829,9.2626101,,Sommerrain,110,48.8151017,9.2463814,,Edelweißweg,441,48.8142101,9.2414727,,Auf der Gans,447,48.8188786,9.2424901,,,50.0,12,4.0,0,2,10,5,0,8,162,Bad Cannstatt,Stuttgart,10829,15143.8,52.3,1.4,stuttgart.de Adressverzeichnis,2026-04-06,"2024,2023,2022",Unfallatlas,71510,bezirk_estimated,15143.8,77,108.2,1082,1513.6,557,778.7,191,267.7,1.0,Bauernladen,"Rosmarinweg 111, 70374 Stuttgart, Germany",274.0,48.818323799999995,9.2482184,,,,,,,,,,,2.0,Restaurant Sommerrain,"Asternweg 1, 70374 Stuttgart, Germany",84.0,48.8154666,9.2475554,Pizza wie beim Italiener,"Schmidener Str. 255, 70374 Stuttgart, Germany",476.0,48.8195579,9.2431081,,,,,,1.0,Flo Bäckerei Dieringer,"Narzissenweg 1, 70374 Stuttgart, Germany",107.0,48.8151863,9.2461659,,,,,,,,,,,1.0,Day care facility for children,"Sophie-Döhring-Straße 6, 70374 Stuttgart, Germany",290.0,48.816072299999995,9.2428574,Catholic kindergarten Holy Cross,"Edelweißweg 5, 70374 Stuttgart, Germany",514.0,48.8144211,9.2402433,"Kindertagesstätte Cannstatter Pforte, BruderhausDiakonie","Lehmfeldstraße 1a, 70374 Stuttgart, Germany",554.0,48.81786,9.2397693,1.0,Grundschule Sommerrain,"Edelweißweg 11, 70374 Stuttgart, Germany",299.0,48.8161989,9.2427369,Eichendorffschule,"Ebitzweg 57, 70374 Stuttgart, Germany",1489.0,48.804427999999994,9.2366935,Anne-Frank-Schule,"Käthe-Kollwitz-Straße 17, 70736 Fellbach, Germany",1549.0,48.8258528,9.2618343,4.0,80.0,True,"The Albertus-Magnus-Gymnasium (AMG) in Stuttgart-Sommerrain is a state-recognized Catholic Free Gymnasium under church sponsorship, founded in 1983. It provides comprehensive general secondary education for approximately 680 students, supported by around 65 teachers. A central pedagogical feature is the application of the Marchtaler Plan, which emphasizes holistic education and individual support. The school places great importance on musical education, offering special string and vocal classes. In terms of languages, English, French (with the option to obtain the DELF certificate), Latin, and Spanish are taught. Furthermore, the AMG is involved in sports partnerships and promotes STEM subjects. The diverse range of extracurricular activities includes a theater group. As a full-day school, the AMG offers comprehensive care, including early morning care, homework and leisure supervision ('Schüler helfen Schülern'), and rhythmized school days for grades 5 and 6. Counseling services such as school mediation, study and career guidance, and school social work support the students' personal development. The school is part of the 'Stiftung Katholische Freie Schule' (Foundation of Catholic Free Schools) and also promotes social projects like 'Bildungsspender.de' to support school activities.","Das Albertus-Magnus-Gymnasium (AMG) in Stuttgart-Sommerrain ist ein staatlich anerkanntes Katholisches Freies Gymnasium mit kirchlicher Trägerschaft, das im Jahr 1983 gegründet wurde. Es bietet eine umfassende allgemeinbildende Sekundarschulbildung für rund 680 Schülerinnen und Schüler, betreut von etwa 65 Lehrkräften. Ein zentrales pädagogisches Merkmal ist die Anwendung des Marchtaler Plans, der eine ganzheitliche Bildung und individuelle Förderung in den Vordergrund stellt. Die Schule legt großen Wert auf musikalische Bildung und bietet spezielle Streicher- und Gesangsklassen an. Im sprachlichen Bereich werden Englisch, Französisch (mit der Möglichkeit zum Erwerb des DELF-Zertifikats), Latein und Spanisch unterrichtet. Darüber hinaus engagiert sich das AMG in Sportpartnerschaften und fördert MINT-Fächer. Das vielfältige AG-Angebot umfasst unter anderem eine Theater-AG. Als Ganztagsschule bietet das AMG eine umfassende Betreuung, einschließlich Frühbetreuung, Hausaufgaben- und Freizeitbetreuung ('Schüler helfen Schülern') sowie rhythmisierte Schultage für die Klassen 5 und 6. Beratungsangebote wie Schulmediation, Studien- und Berufsberatung sowie Schulsozialarbeit unterstützen die persönliche Entwicklung der Schüler. Die Schule ist in die Stiftung Katholische Freie Schule eingebunden und fördert auch soziale Projekte wie 'Bildungsspender.de' zur Unterstützung schulischer Aktivitäten.","The Albertus-Magnus-Gymnasium in Stuttgart is a state-recognized Catholic Free Gymnasium, founded in 1983, with approximately 680 students. It is characterized by the Marchtaler Plan, musical focuses (string/vocal classes), sports partnerships, STEM promotion, and a wide range of languages (English, French, Latin, Spanish). As a full-day school, it offers comprehensive care and diverse extracurricular activities.","Das Albertus-Magnus-Gymnasium in Stuttgart ist ein 1983 gegründetes, staatlich anerkanntes Katholisches Freies Gymnasium mit rund 680 Schülern. Es zeichnet sich durch den Marchtaler Plan, musikalische Schwerpunkte (Streicher-/Gesangsklassen), Sportpartnerschaften, MINT-Förderung und ein breites Sprachenangebot (Englisch, Französisch, Latein, Spanisch) aus. Als Ganztagsschule bietet es umfassende Betreuung und vielfältige AGs."
STG-19807,Altenburgschule Gemeinschaftsschule,Gemeinschaftsschule,Gemeinschaftsschule,Auf der Altenburg 10,19807,Stuttgart,Bad Cannstatt,Stuttgart,Baden-Württemberg,48.811056697728354,9.207739794032952,0711 21667120,,Poststelle.Altenburgschule@stuttgart.de,http://www.altenburgschule.de/,,Öffentlich,Anke Leitzinger,650.0,50.0,"Englisch, Französisch",1914.0,"Leseförderung (BiSS!), Bewegungsförderung, Musikprofil, Inklusion, Erlebnispädagogik, Sozialcurriculum",19,35,Bad Cannstatt,1264,48.8014069,9.2168515,,Stuttgart Nordbahnhof,1655,48.80373,9.188064,,Sommerrain,3022,48.8152317,9.248517,,Riethmüllerhaus,413,48.8136792,9.2037365,,Glockenstraße (Mahle),418,48.8080817,9.2042424,,Züricher Straße,570,48.8104235,9.2000139,,Altenburg,164,48.8113562,9.2099328,,Am Römerkastell,250,48.8132203,9.208649,,Züricher Straße,440,48.8108989,9.2017391,,,50.0,43,14.3,0,6,37,11,9,20,63,Bad Cannstatt,Stuttgart,10829,15143.8,52.3,1.4,stuttgart.de Adressverzeichnis,2026-04-06,"2024,2023,2022",Unfallatlas,71510,bezirk_estimated,15143.8,77,108.2,1082,1513.6,557,778.7,191,267.7,2.0,El-Farra Supermarkt,"Am Römerkastell 8, 70376 Stuttgart, Germany",192.0,48.8127746,9.2075233,REWE,"Naststraße 17, 70376 Stuttgart, Germany",327.0,48.8137408,9.2095756,,,,,,20.0,Demet's Burger & Chicken,"Hallschlag 21, 70376 Stuttgart, Germany",226.0,48.8129202,9.2089657,Demet's Döner Kebap & Pizza Türkische Spezialitäten,"Hallschlag 27, 70376 Stuttgart, Germany",255.0,48.8132909,9.2084968,Brückenstüble bei Milo,"Brückenstraße 55, 70376 Stuttgart, Germany",260.0,48.8091205,9.2097302,3.0,Balkan Bäckerei,"Hallschlag 27, 70376 Stuttgart, Germany",247.0,48.8132112,9.2085733,"Bäcker Maurer, Römerkastell Stuttgart (im REWE)","Naststraße 17, 70376 Stuttgart, Germany",307.0,48.81351,9.2096682,Café Bar Albatros,"Brückenstraße 32, 70376 Stuttgart, Germany",390.0,48.8081444,9.2107097,5.0,Kinder- und Familienzentrum Maria Regina,"Auf d. Steig 12, 70376 Stuttgart, Germany",341.0,48.8130576,9.2042139,Betriebskita Mahle,"Glockenstraße 46, 70376 Stuttgart, Germany",348.0,48.809003999999995,9.2041507,Kinder- und Familienzentrum Duisburger Straße (KiFaZ),"Duisburger Str. 53, 70376 Stuttgart, Germany",459.0,48.8091931,9.2133305,0.0,Carl-Benz-Schule,"Weckherlinstraße 8, 70376 Stuttgart, Germany",803.0,48.8162544,9.2153533,Lessing-Schulen,"Zuckerfabrik 7, 70376 Stuttgart, Germany",1171.0,48.82076,9.213967,Elise von König Gemeinschaftsschule,"Nagoldstraße 7, 70376 Stuttgart, Germany",1432.0,48.819917,9.2219409,4.0,,,"The Altenburg-Gemeinschaftsschule in Stuttgart is a public educational institution that includes both a primary level and Secondary Level I. It is located at Auf der Altenburg 10, 70376 Stuttgart. As a community school, it places great emphasis on individual learning and social development. The pedagogical concept is based on a clear mission statement and school rules, a social curriculum, experiential education approaches, and the class council, actively involving students in shaping school life. The school is characterized by its special focus areas in reading, music, and movement. This is promoted through targeted reading support, a distinct music profile, and diverse physical activity programs. Altenburgschule offers comprehensive all-day care with school meals, providing parents with flexible childcare and opening up additional learning and leisure opportunities for students. In Secondary Level I, elective and profile subjects are offered, catering to the individual interests and talents of the learners. The school prepares students for various qualifications and examinations, including exams for German, Mathematics, English, and elective subjects such as Technology, AES (Applied Economics and Social Sciences), and French, indicating a broad range of subjects. Altenburgschule fosters a strong school community through the active participation of the student council (SMV), parent council, and a support association. It also provides extensive counseling and support services, school social work, and thorough career orientation and counseling to best prepare students for their future. Regular events and projects, such as choir performances, sports days, and internships, enrich daily school life and contribute to a vibrant learning environment. The school is thus a place where academic education goes hand in hand with personal development and social engagement.","Die Altenburg-Gemeinschaftsschule in Stuttgart ist eine öffentliche Bildungseinrichtung, die sowohl eine Primarstufe als auch die Sekundarstufe I umfasst. Sie befindet sich in der Auf der Altenburg 10, 70376 Stuttgart. Als Gemeinschaftsschule legt sie großen Wert auf individuelles Lernen und soziale Entwicklung. Das pädagogische Konzept basiert auf einem klaren Leitbild und Schulregeln, einem Sozialcurriculum, erlebnispädagogischen Ansätzen und dem Klassenrat, um die Schülerinnen und Schüler aktiv in die Gestaltung des Schullebens einzubeziehen. Die Schule zeichnet sich durch ihre besonderen Schwerpunkte in den Bereichen Lesen, Musik und Bewegung aus. Dies wird durch gezielte Leseförderung, ein ausgeprägtes Musikprofil und vielfältige Bewegungsangebote gefördert. Die Altenburgschule bietet eine umfassende Ganztagesbetreuung mit Schulessen an, was den Eltern eine flexible Betreuung ermöglicht und den Schülerinnen und Schülern zusätzliche Lern- und Freizeitangebote eröffnet. Im Bereich der Sekundarstufe I werden Wahlpflichtfächer und Profilfächer angeboten, die den individuellen Neigungen und Talenten der Lernenden Rechnung tragen. Die Schule bereitet auf verschiedene Abschlüsse und Prüfungen vor, darunter auch die Prüfungen für Deutsch, Mathematik, Englisch und Wahlpflichtfächer wie Technik, AES und Französisch, was auf ein breites Fächerangebot hindeutet. Die Altenburgschule fördert eine starke Schulgemeinschaft durch die aktive Beteiligung von Schülervertretung (SMV), Elternbeirat und Förderverein. Sie bietet zudem umfangreiche Beratungs- und Förderangebote, Schulsozialarbeit sowie eine fundierte Berufsorientierung und -beratung, um die Schülerinnen und Schüler bestmöglich auf ihre Zukunft vorzubereiten. Regelmäßige Veranstaltungen und Projekte, wie Chorauftritte, Sporttage und Praktika, bereichern den Schulalltag und tragen zu einem lebendigen Lernumfeld bei. Die Schule ist somit ein Ort, an dem akademische Bildung mit persönlicher Entwicklung und sozialem Engagement Hand in Hand gehen.","Altenburg-Gemeinschaftsschule in Stuttgart is a public school with primary and secondary levels, fostering individual learning and social development. Key focuses include reading, music, and movement, complemented by all-day care and diverse elective subjects. The school emphasizes an active community and comprehensive counseling to prepare students for their future.","Die Altenburg-Gemeinschaftsschule in Stuttgart ist eine öffentliche Schule mit Primar- und Sekundarstufe I, die individuelles Lernen und soziale Entwicklung fördert. Schwerpunkte liegen auf Lesen, Musik und Bewegung, ergänzt durch Ganztagesbetreuung und vielfältige Wahlfächer. Die Schule legt Wert auf eine aktive Schulgemeinschaft und umfassende Beratung zur Vorbereitung auf die Zukunft."
STG-46763,Altenburgschule Gemeinschaftschule (Außenstelle) Reiterkaserne,Gemeinschaftsschule,Gemeinschaftsschule,Hallschlag 4,46763,Stuttgart,Bad Cannstatt,Stuttgart,Baden-Württemberg,48.81231152358713,9.210278454990831,0711 21667120,,,https://www.stuttgart-inklusiv.de/,,Öffentlich,Frau Leitzinger,700.0,,"Englisch, Französisch",1914.0,"Inklusion, Leseförderung, Musikprofil, Bewegungsförderung, Zusammenarbeit mit Jugendhilfe.",11,35,Bad Cannstatt,1305,48.8014069,9.2168515,,Stuttgart Nordbahnhof,1886,48.80373,9.188064,,Sommerrain,2819,48.8152317,9.248517,,Riethmüllerhaus,499,48.8140452,9.2039927,,Glockenstraße (Mahle),645,48.8080817,9.2042424,,Rosensteinbrücke,713,48.8059151,9.2096405,,Altenburg,23,48.8121078,9.2102748,,Am Römerkastell,156,48.8132203,9.208649,,Martinskirche,526,48.8075941,9.210888,,,50.0,40,13.3,0,7,33,8,8,19,52,Bad Cannstatt,Stuttgart,10829,15143.8,52.3,1.4,stuttgart.de Adressverzeichnis,2026-04-06,"2024,2023,2022",Unfallatlas,71510,bezirk_estimated,15143.8,77,108.2,1082,1513.6,557,778.7,191,267.7,3.0,REWE,"Naststraße 17, 70376 Stuttgart, Germany",167.0,48.8137408,9.2095756,El-Farra Supermarkt,"Am Römerkastell 8, 70376 Stuttgart, Germany",208.0,48.8127746,9.2075233,ROCK UG (haftungsbeschränkt),"Rostocker Str. 3, 70376 Stuttgart, Germany",462.0,48.8161548,9.2078774,19.0,Demet's Burger & Chicken,"Hallschlag 21, 70376 Stuttgart, Germany",118.0,48.8129202,9.2089657,"Bäcker Maurer, Römerkastell Stuttgart (im REWE)","Naststraße 17, 70376 Stuttgart, Germany",141.0,48.81351,9.2096682,Ristorante Rusticone,"Naststraße 15, D, 70376 Stuttgart, Germany",159.0,48.813399,9.208863,5.0,"Bäcker Maurer, Römerkastell Stuttgart (im REWE)","Naststraße 17, 70376 Stuttgart, Germany",141.0,48.81351,9.2096682,Balkan Bäckerei,"Hallschlag 27, 70376 Stuttgart, Germany",160.0,48.8132112,9.2085733,Nachbar Kneipe und Kultur,"Am Römerkastell 73, 70376 Stuttgart, Germany",314.0,48.8151112,9.2108166,5.0,Kinderhaus Hallschlag gGmbH,"Am Römerkastell 73, 70376 Stuttgart, Germany",282.0,48.8148458,9.2104461,Kindertagesstätte Villa Rosenrot e.V.,"Rommelstraße 15, 70376 Stuttgart, Germany",352.0,48.814520300000005,9.2137144,Villa Rosenrot Kita,"Naststraße 1, 70376 Stuttgart, Germany",356.0,48.8148257,9.213297,1.0,Altenburgschule,"Auf d. Altenburg 10, 70376 Stuttgart, Germany",238.0,48.8111024,9.2075978,Carl-Benz-Schule,"Weckherlinstraße 8, 70376 Stuttgart, Germany",575.0,48.8162544,9.2153533,Lessing-Schulen,"Zuckerfabrik 7, 70376 Stuttgart, Germany",977.0,48.82076,9.213967,7.0,,,"The Altenburgschule Gemeinschaftsschule (Außenstelle) Reiterkaserne in Stuttgart is a public secondary school with a rich history, tracing its origins back to its founding in 1914. Led by Frau Leitzinger, the school is dedicated to providing comprehensive education and individual support for its approximately 700 students. A core characteristic of the Altenburgschule is its strong commitment to inclusion, aiming to offer a supportive and nurturing learning environment to all students, regardless of their individual needs.

The school's educational profile is distinguished by several special features. Literacy promotion plays a crucial role in sustainably strengthening students' linguistic competencies. Furthermore, the school offers a distinct music profile that encourages creative expression and develops musical talents. Physical activity promotion is another key focus, supporting the physical well-being and activity of young people. A notable aspect is also the close collaboration with youth welfare services, which ensures holistic care and support for students in various aspects of their lives.

Within the curriculum, in addition to German, foreign languages such as English and French are offered to provide students with a broad linguistic foundation for their future careers. The Altenburgschule Gemeinschaftsschule (Außenstelle) Reiterkaserne, located at Hallschlag 4 in 46763 Stuttgart, sees itself as a modern educational institution that combines tradition with innovative pedagogical approaches to create a future-oriented and appreciative learning culture. The school places great emphasis on developing social skills and preparing students for an independent life in a diverse society.","Die Altenburgschule Gemeinschaftsschule (Außenstelle) Reiterkaserne in Stuttgart ist eine öffentliche weiterführende Schule mit einer langen Geschichte, die bis zu ihrer Gründung im Jahr 1914 zurückreicht. Unter der Leitung von Frau Leitzinger engagiert sich die Schule für eine umfassende Bildung und individuelle Förderung ihrer rund 700 Schülerinnen und Schüler. Ein zentrales Merkmal der Altenburgschule ist ihr starkes Engagement für Inklusion, das darauf abzielt, allen Lernenden, unabhängig von ihren individuellen Bedürfnissen, eine unterstützende und fördernde Lernumgebung zu bieten.

Das pädagogische Profil der Schule zeichnet sich durch mehrere Besonderheiten aus. Die Leseförderung spielt eine wichtige Rolle, um die sprachlichen Kompetenzen der Schülerinnen und Schüler nachhaltig zu stärken. Darüber hinaus bietet die Schule ein ausgeprägtes Musikprofil, das kreative Ausdrucksformen fördert und musikalische Talente entwickelt. Die Bewegungsförderung ist ein weiterer Schwerpunkt, der die körperliche Aktivität und das Wohlbefinden der Jugendlichen unterstützt. Ein besonderes Merkmal ist auch die enge Zusammenarbeit mit der Jugendhilfe, die eine ganzheitliche Betreuung und Unterstützung der Schülerinnen und Schüler in verschiedenen Lebensbereichen gewährleistet.

Im Rahmen des Lehrplans werden neben Deutsch auch die Fremdsprachen Englisch und Französisch angeboten, um den Schülerinnen und Schülern eine breite sprachliche Basis für ihre zukünftige Laufbahn zu vermitteln. Die Altenburgschule Gemeinschaftsschule (Außenstelle) Reiterkaserne, gelegen am Hallschlag 4 in 46763 Stuttgart, versteht sich als eine moderne Bildungseinrichtung, die Tradition mit innovativen pädagogischen Ansätzen verbindet, um eine zukunftsorientierte und wertschätzende Lernkultur zu schaffen. Die Schule legt großen Wert auf die Entwicklung sozialer Kompetenzen und die Vorbereitung auf ein selbstbestimmtes Leben in einer vielfältigen Gesellschaft.","Altenburgschule Gemeinschaftsschule (Außenstelle) Reiterkaserne is a public secondary school in Stuttgart, founded in 1914, serving approximately 700 students under the leadership of Frau Leitzinger. It is characterized by a strong commitment to inclusion, literacy promotion, a music profile, physical activity promotion, and close collaboration with youth welfare services. The school offers English and French as foreign languages, fostering holistic development for its learners.","Die Altenburgschule Gemeinschaftsschule (Außenstelle) Reiterkaserne ist eine öffentliche Stuttgarter Sekundarschule, die 1914 gegründet wurde und rund 700 Schülerinnen und Schüler unter der Leitung von Frau Leitzinger betreut. Sie zeichnet sich durch ein starkes Engagement für Inklusion, Leseförderung, ein Musikprofil, Bewegungsförderung und eine enge Zusammenarbeit mit der Jugendhilfe aus. Die Schule bietet Englisch und Französisch als Fremdsprachen an und fördert eine ganzheitliche Entwicklung ihrer Lernenden."
