STG-18544,Königin-Charlotte-Gymnasium,Gymnasium,Gymnasium,Sigmaringer Straße 85,18544,Stuttgart,Möhringen,Stuttgart,Baden-Württemberg,48.73005299810524,9.152685098383822,0711 21633750,,Poststelle.Koenigin-Charlotte-Gymnasium@stuttgart.de,https://www.stuttgart-inklusiv.de/,,Öffentlich,Benjamin Köhler,,59.0,"Englisch, Latein, Französisch, Spanisch, Japanisch",1914.0,"Bilingualer Zug (Englisch), MINT-freundliche Schule, Sportprofil, KI-Pilotschule, Japanisch-AG.",13,24,U-Bahn (48.7175),1634,48.7174685,9.1411963,,U-Bahn (48.7485),2332,48.748473,9.167888,,U-Bahn (48.7490),2444,48.7490455,9.1694659,,Sigmaringer Straße,153,48.7287206,9.1532295,,Riedsee,362,48.7329786,9.1505075,,Möhringen Bahnhof,424,48.7305833,9.1469571,,Rembrandtstraße,285,48.7280598,9.1502447,,Riedsee,285,48.7322268,9.1506162,,Bus (48.7281),288,48.7280846,9.1501421,,,70.0,42,14.0,0,2,40,18,9,27,156,Möhringen,Stuttgart,2461,7571.9,52.3,0.7,stuttgart.de Adressverzeichnis,2026-04-06,"2024,2023,2022",Unfallatlas,32500,bezirk_estimated,7571.9,18,54.1,246,756.8,127,389.3,43,133.8,0.0,,,,,,,,,,,,,,,,0.0,,,,,,,,,,,,,,,,5.0,Kaufland,"Rembrandtstraße 47, 70567 Stuttgart, Germany",202.0,48.7310371,9.1503644,Treiber Spezialitäten Bäckerei Konditorei,"Rembrandtstraße 47, 70567 Stuttgart, Germany",205.0,48.731105199999995,9.1503883,Garagenbackstüble,"Holdermannstraße 32, 70567 Stuttgart, Germany",313.0,48.7298744,9.1484199,6.0,Johanniter-Unfall-Hilfe e.V. - Kita Die kleinen Entdecker,"Trochtelfinger Str. 6, 70567 Stuttgart, Germany",258.0,48.7306258,9.1560909,Kath. Kinderhaus St. Hedwig,"Probststraße 41, 70567 Stuttgart, Germany",306.0,48.7316283,9.1492591,Tageseinrichtung für Kinder,"Holdermannstraße 9, 70567 Stuttgart, Germany",375.0,48.7279547,9.1486754,0.0,Salzäckerschule Stuttgart-Möhringen,"Rulfinger Str. 35, 70567 Stuttgart, Germany",971.0,48.7216617,9.1563536,Freie Aktive Schule Stuttgart,"Bopseräcker 30-33, 70597 Stuttgart, Germany",1285.0,48.7345437,9.1688321,Albschule,"Wurmlinger Str. 61, 70597 Stuttgart, Germany",1640.0,48.7428819,9.1637145,9.0,,,"Königin-Charlotte-Gymnasium in Stuttgart, established in 1914, is a public secondary school with a rich tradition, distinguished by its broad and modern educational offerings. Under the leadership of Benjamin Köhler, 59 teachers are dedicated to the academic and personal development of their students. The school provides a diverse language education, including English, Latin, French, Spanish, and even a Japanese extracurricular group, highlighting the institution's international focus. A notable feature is the bilingual English stream, which allows students to delve into subject matter in English and enhance their language proficiency to a high standard. As a 'MINT-friendly school' (STEM-friendly), Königin-Charlotte-Gymnasium places a strong emphasis on Mathematics, Informatics, Natural Sciences, and Technology, fostering talent in these areas through specialized programs and projects. Furthermore, the school offers a distinct sports profile, prioritizing athletic activities and the development of teamwork. As an 'AI pilot school,' the gymnasium is also a pioneer in integrating Artificial Intelligence into its curriculum, preparing students for the challenges of the digital future. This combination of academic excellence, linguistic diversity, STEM promotion, athletic engagement, and forward-thinking technology integration makes Königin-Charlotte-Gymnasium a dynamic and comprehensive educational institution in Stuttgart.","Das Königin-Charlotte-Gymnasium in Stuttgart, gegründet im Jahr 1914, ist eine traditionsreiche öffentliche weiterführende Schule, die sich durch ein breites und modernes Bildungsangebot auszeichnet. Unter der Leitung von Benjamin Köhler engagieren sich 59 Lehrkräfte für die akademische und persönliche Entwicklung der Schülerinnen und Schüler. Die Schule bietet eine vielfältige Sprachenausbildung mit Englisch, Latein, Französisch, Spanisch und sogar Japanisch als AG an, was den internationalen Fokus der Einrichtung unterstreicht. Ein besonderes Merkmal ist der bilinguale Zug in Englisch, der es den Lernenden ermöglicht, Fachinhalte in englischer Sprache zu vertiefen und ihre Sprachkompetenzen auf hohem Niveau auszubauen. Als 'MINT-freundliche Schule' legt das Königin-Charlotte-Gymnasium einen starken Schwerpunkt auf Mathematik, Informatik, Naturwissenschaften und Technik und fördert Talente in diesen Bereichen durch spezielle Programme und Projekte. Darüber hinaus bietet die Schule ein ausgeprägtes Sportprofil, das sportliche Aktivitäten und die Entwicklung von Teamgeist in den Vordergrund stellt. Als 'KI-Pilotschule' ist das Gymnasium zudem Vorreiter in der Integration von Künstlicher Intelligenz in den Unterricht, um Schülerinnen und Schüler auf die Herausforderungen der digitalen Zukunft vorzubereiten. Die Kombination aus akademischer Exzellenz, sprachlicher Vielfalt, MINT-Förderung, sportlicher Betätigung und zukunftsweisender Technologieintegration macht das Königin-Charlotte-Gymnasium zu einer dynamischen und umfassenden Bildungseinrichtung in Stuttgart.","Königin-Charlotte-Gymnasium in Stuttgart, founded in 1914, is a public secondary school with 59 teachers and headmaster Benjamin Köhler. It offers a bilingual English stream, is a STEM-friendly school, features a sports profile, and is an AI pilot school. Language offerings include English, Latin, French, Spanish, and Japanese.","Das Königin-Charlotte-Gymnasium in Stuttgart ist eine 1914 gegründete öffentliche weiterführende Schule mit 59 Lehrkräften und Schulleiter Benjamin Köhler. Es bietet einen bilingualen englischen Zug, ist eine MINT-freundliche Schule, verfügt über ein Sportprofil und ist eine KI-Pilotschule. Das Sprachenangebot umfasst Englisch, Latein, Französisch, Spanisch und Japanisch."
STG-18106,Königin-Olga-Stift,Gymnasium,Gymnasium,Johannesstraße 18,18106,Stuttgart,West,Stuttgart,Baden-Württemberg,48.77518018374312,9.1634655373294,0711 21657610,,Poststelle.Koenigin-Olga-Stift@stuttgart.de,http://www.olga-stift.de/,,Öffentlich,René Wollnitz,480.0,56.0,"Englisch, Französisch, Russisch",1873.0,"Bilinguales Gymnasium (Englisch), naturwissenschaftlich-technologisches Profil (MINT-EC Schule), Partnerschule für Europa und die Welt, Debating Club, Theater.",42,136,U-Bahn (48.7725),308,48.7724517,9.1641789,,U-Bahn (48.7724),309,48.7724419,9.1641465,,Stuttgart Feuersee,338,48.7726044,9.1659138,,Schloss-/Johannesstraße,155,48.7763679,9.162352,,Berliner Platz (Hohe Straße),433,48.7771517,9.168557,,Berliner Platz (Liederhalle),469,48.7785048,9.1673952,,Schloss-/Johannesstraße,124,48.7761221,9.16255,,Feuersee,323,48.7734425,9.1669978,,Feuersee Position 2,324,48.773473,9.1670514,,"42, 43, 44, N10, N2",65.0,102,34.0,0,11,91,40,15,57,53,West,Stuttgart,6952,12980.4,52.3,1.2,stuttgart.de Adressverzeichnis,2026-04-06,"2024,2023,2022",Unfallatlas,53560,bezirk_estimated,12980.4,50,92.7,695,1297.3,357,667.4,123,229.4,0.0,,,,,,,,,,,,,,,,20.0,Kaffeerösterei Café Moulu / Stuttgart,"Senefelderstraße 58, 70176 Stuttgart, Germany",174.0,48.7753088,9.1610953,bona'me,"Schloßstraße 70, 70176 Stuttgart, Germany",278.0,48.7775433,9.1646917,SUTSCHE,"Breitscheidstraße 38, 70176 Stuttgart, Germany",283.0,48.77769250000001,9.1641087,20.0,Kiosko,"Johannesstraße 9, 70176 Stuttgart, Germany",84.0,48.7744277,9.1635368,Baker Harald Dreßler,"Ludwigstraße 44, 70176 Stuttgart, Germany",165.0,48.7741926,9.1617913,Kaffeerösterei Café Moulu / Stuttgart,"Senefelderstraße 58, 70176 Stuttgart, Germany",174.0,48.7753088,9.1610953,10.0,Schloßkinder Stuttgart - pme Familienservice,"Schloßstraße 74-76, 70176 Stuttgart, Germany",195.0,48.776934,9.1635942,"Early Bird Club - Private Krippe, KiTa und Kindergarten in Stuttgart-Mitte","Weimarstraße 21, 70176 Stuttgart, Germany",234.0,48.7757369,9.1665503,EKiZ im Generationenhaus West,"Ludwigstraße 41-43, 70176 Stuttgart, Germany",241.0,48.7737699,9.160971,3.0,Falkert-Schule,"Falkertstraße 27, 70176 Stuttgart, Germany",370.0,48.778442,9.164479,Schwabschule,"Bebelstraße 17, 70176 Stuttgart, Germany",476.0,48.774467400000006,9.1570644,Johannes Brenz Schule,"Hohe Str. 11, 70174 Stuttgart, Germany",497.0,48.777019,9.1696535,19.0,,,"The Königin-Olga-Stift in Stuttgart is a public, general-education secondary school (Gymnasium) with a more than 150-year educational tradition, founded in 1873. Named after Queen Olga of Württemberg, known for her linguistic and mathematical abilities, the school fosters a performance-oriented learning culture that promotes individual talents and potentials. With approximately 480 students taught by 56 dedicated teachers, the Gymnasium prepares its young people for a changing world. The school is characterized by two distinct profiles: a linguistic-bilingual profile with English as the bilingual language of instruction, and a scientific-technological profile. As a MINT-EC school, Königin-Olga-Stift places great emphasis on promoting mathematics, computer science, natural sciences, and technology, which is reflected in activities such as the Science Fair. The language offerings are complemented by French and Russian, and the school offers certifications like Cambridge and DELF. As a ""Partner School for Europe and the World,"" Königin-Olga-Stift promotes intercultural competencies through numerous exchange programs, including a USA exchange. School life is rich in activities and extracurricular groups (AGs) that help discover and develop creative talents, such as the Debating Club and theater performances. A personal atmosphere and respectful interaction characterize the school community, which regularly gathers at events like ""Advent im Olga"" or piano concerts. Under the leadership of René Wollnitz, the school strives to provide a comprehensive education, develop well-oriented personalities, and build social competencies. The address is Johannesstraße 18, 18106 Stuttgart.","Das Königin-Olga-Stift in Stuttgart ist ein öffentliches, allgemeinbildendes Gymnasium mit einer über 150-jährigen Bildungstradition, gegründet im Jahr 1873. Benannt nach Königin Olga von Württemberg, die für ihre Sprachkenntnisse und mathematischen Fähigkeiten bekannt war, pflegt die Schule eine leistungsorientierte Lernkultur, die individuelle Begabungen und Potenziale fördert. Mit rund 480 Schülerinnen und Schülern, die von 56 engagierten Lehrkräften unterrichtet werden, bereitet das Gymnasium seine jungen Menschen auf eine sich wandelnde Welt vor. Die Schule zeichnet sich durch zwei ausgeprägte Profile aus: ein sprachlich-bilinguales Profil mit Englisch als bilingualer Unterrichtssprache und ein naturwissenschaftlich-technologisches Profil. Als MINT-EC Schule legt das Königin-Olga-Stift großen Wert auf die Förderung in Mathematik, Informatik, Naturwissenschaften und Technik, was sich in Aktivitäten wie der Science Fair widerspiegelt. Das sprachliche Angebot wird durch Französisch und Russisch ergänzt, und die Schule bietet Zertifikate wie Cambridge und DELF an. Als ""Partnerschule für Europa und die Welt"" fördert das Königin-Olga-Stift interkulturelle Kompetenzen durch zahlreiche Austauschprogramme, darunter ein USA-Austausch. Das Schulleben ist reich an Aktivitäten und AGs, die kreative Talente entdecken und entwickeln helfen, wie der Debating Club und Theateraufführungen. Eine persönliche Atmosphäre und ein wertschätzender Umgang prägen die Schulgemeinschaft, die sich regelmäßig bei Veranstaltungen wie dem ""Advent im Olga"" oder Flügelkonzerten trifft. Unter der Leitung von René Wollnitz strebt die Schule danach, eine umfassende Bildung zu vermitteln, orientierungsfähige Persönlichkeiten zu entwickeln und soziale Kompetenzen aufzubauen. Die Adresse ist Johannesstraße 18, 18106 Stuttgart.","Königin-Olga-Stift is a public secondary school in Stuttgart with over 150 years of tradition, educating 480 students with 56 teachers. It offers a bilingual (English) and a scientific-technological (MINT-EC) profile, along with French and Russian. The school promotes achievement, individual talents, and intercultural competencies as a ""Partner School for Europe and the World"" through various extracurricular activities and exchange programs.","Das Königin-Olga-Stift ist ein öffentliches Gymnasium in Stuttgart mit einer über 150-jährigen Tradition, das 480 Schüler von 56 Lehrkräften unterrichtet. Es bietet ein bilinguales (Englisch) und ein naturwissenschaftlich-technologisches (MINT-EC) Profil sowie Französisch und Russisch an. Die Schule fördert Leistung, individuelle Talente und interkulturelle Kompetenzen als ""Partnerschule für Europa und die Welt"" durch vielfältige AGs und Austauschprogramme."
STG-18110,Königin-Katharina-Stift,Gymnasium,Gymnasium,Schillerstraße 5,18110,Stuttgart,Mitte,Stuttgart,Baden-Württemberg,48.7814708443925,9.185592652060627,0711 21696651,,Poststelle.Koenigin-Katharina-Stift@stuttgart.de,http://www.koenigin-katharina-stift.de/,,Öffentlich,Kathrin von Vacano-Grohmann,600.0,65.0,"Englisch, Französisch, Latein, Italienisch, Japanisch",1818.0,"Bilingual-italienisches Profil, Hochbegabtenzug, MINT-Profil, Kulturmeilenschule, Boris-Berufswahl-Siegel, deutsch-italienisches Doppelabitur, IMP-Profil, Chor, Orchester, Instrumentalunterricht, Theater, Tanz, Judo, Lego League, First Tech Challenge, Kooperationen mit Staatstheater und Staatsgalerie.",0,32,Schlossplatz,534,48.7791984,9.1791684,,Friedrichsbau (Börse),733,48.7798416,9.1758929,,Eingang Rathaus (U-Bahn),868,48.774433,9.1804719,,Schlossplatz,545,48.7791041,9.1790863,,Rathaus,979,48.7735198,9.1798691,,Rotebühlplatz,1221,48.7744652,9.1727667,,Schlossplatz,600,48.7776066,9.1798868,,Kleiner Schlossplatz,699,48.7794496,9.1765651,,Büchsenstraße,926,48.777447,9.1745259,,,35.0,165,55.0,0,9,156,47,10,93,24,Mitte,Stuttgart,6539,27042.5,52.3,2.5,stuttgart.de Adressverzeichnis,2026-04-06,"2024,2023,2022",Unfallatlas,24180,bezirk_estimated,27042.5,47,193.2,654,2702.8,336,1390.5,116,478.0,11.0,dm-drogerie markt,"Königstraße 2, 70173 Stuttgart, Germany",301.0,48.782618,9.181865,EuroShop,"Arnulf-Klett-Passage 23, 70173 Stuttgart, Germany",320.0,48.7824914,9.1815057,Imbiss und Market Alsendiebad,"Urbanstraße 61, 70182 Stuttgart, Germany",335.0,48.78291420000001,9.1896074,20.0,Zum Becher,"Urbanstraße 33, 70182 Stuttgart, Germany",260.0,48.7793673,9.1871474,Kwan Kao - Taste of Thailand,"Urbanstraße 48, 70182 Stuttgart, Germany",270.0,48.779463,9.187654,DAS TEMPUS - Café I Bistro I Bar,"Konrad-Adenauer-Straße 16, 70173 Stuttgart, Germany",311.0,48.778679999999994,9.1858407,20.0,Bäckerei Konditorei Café Nast,"Urbanstraße 55, 70182 Stuttgart, Germany",291.0,48.7824087,9.189294,Yorma's,"Arnulf-Klett-Passage 33, 70173 Stuttgart, Germany",297.0,48.7827387,9.1820249,Tempus - Urban Café & Location,"Konrad-Adenauer-Straße 16, 70173 Stuttgart, Germany",309.0,48.7787162,9.1861843,3.0,element-i Kinderhaus Spielzeit,"Urbanspl. 2, 70182 Stuttgart, Germany",267.0,48.7799443,9.1884029,Evang. Kindertagesstätte Heidehüpfer,"Urbanstraße 40, 70182 Stuttgart, Germany",309.0,48.7789058,9.1872127,Luise-Römer-Kindergarten,"Werastraße 19, 70182 Stuttgart, Germany",355.0,48.7793826,9.1892584,0.0,Ameisenbergschule,"Ameisenbergstraße 2, 70188 Stuttgart, Germany",700.0,48.7840385,9.1943142,Galileo primary school and daycare,"Alexanderstraße 22, 70184 Stuttgart, Germany",773.0,48.7748257,9.1887079,Grundschule Lampertswalde,"Schulstraße 1, 70173 Stuttgart, Germany",883.0,48.775467299999995,9.1777051,13.0,,,"Königin-Katharina-Stift is a traditional public secondary school (Gymnasium) in Stuttgart, founded in 1818 and located on Stuttgart's 'Kulturmeile'. With approximately 600 students and 65 teachers, the school offers a diverse educational program. A special focus is placed on its bilingual Italian profile, which can lead to a German-Italian double Abitur and is complemented by intensive exchange programs with Italy. Furthermore, the school features a program for highly gifted students and a strong MINT (STEM) profile, fostered through competitions such as the First Lego League, First Tech Challenge, World Robot Olympiad, and Jugend forscht. Königin-Katharina-Stift is also recognized as a 'Kulturmeilenschule' and holds the Boris-Berufswahl-Siegel, highlighting its comprehensive career orientation. The language offerings are extensive, including English, French, Latin, Italian, and Japanese. In the realm of fine arts, the school provides choir, orchestra, instrumental lessons, theater, dance, and collaborations with the State Theater and State Gallery. School life is enriched by a full-day program with a cafeteria, homework support, and various extracurricular activities, including Judo. The school is led by Kathrin von Vacano-Grohmann. The institution emphasizes a comprehensive social curriculum and methodology days to optimally prepare students for their future.","Das Königin-Katharina-Stift ist ein traditionsreiches öffentliches Gymnasium in Stuttgart, das 1818 gegründet wurde und sich an der Stuttgarter Kulturmeile befindet. Mit rund 600 Schülern und 65 Lehrkräften bietet die Schule ein vielfältiges Bildungsangebot. Ein besonderer Schwerpunkt liegt auf dem bilingual-italienischen Profil, das zum deutsch-italienischen Doppelabitur führen kann und durch intensive Austauschprogramme mit Italien ergänzt wird. Darüber hinaus verfügt die Schule über einen Hochbegabtenzug und ein ausgeprägtes MINT-Profil, das durch Wettbewerbe wie die First Lego League, First Tech Challenge, World Robot Olympiad und Jugend forscht gefördert wird. Das Königin-Katharina-Stift ist zudem eine Kulturmeilenschule und trägt das Boris-Berufswahl-Siegel, was die umfassende Berufsorientierung unterstreicht. Das Sprachenangebot ist breit gefächert und umfasst Englisch, Französisch, Latein, Italienisch und Japanisch. Im Bereich der schönen Künste bietet die Schule Chor, Orchester, Instrumentalunterricht, Theater, Tanz und Kooperationen mit dem Staatstheater und der Staatsgalerie. Das Schulleben wird durch ein Ganztagsangebot mit Mensa, Hausaufgabenbetreuung und vielfältigen Arbeitsgemeinschaften bereichert, darunter auch Judo. Die Schulleitung obliegt Kathrin von Vacano-Grohmann. Die Schule legt Wert auf ein umfassendes Sozialcurriculum und Methodentage, um die Schüler bestmöglich auf ihre Zukunft vorzubereiten.","Königin-Katharina-Stift is a public secondary school in Stuttgart, founded in 1818, with 600 students and 65 teachers. It features a bilingual Italian profile leading to a double Abitur, a program for highly gifted students, a MINT profile, and diverse artistic offerings. The school also provides comprehensive career orientation and international exchange programs.","Das Königin-Katharina-Stift ist ein 1818 gegründetes öffentliches Gymnasium in Stuttgart mit 600 Schülern und 65 Lehrkräften. Es zeichnet sich durch ein bilingual-italienisches Profil mit Doppelabitur, einen Hochbegabtenzug, ein MINT-Profil und vielfältige künstlerische Angebote aus. Die Schule bietet zudem umfassende Berufsorientierung und internationale Austauschprogramme."
STG-17763,Körschtalschule Gemeinschaftsschule,Gemeinschaftsschule,Gemeinschaftsschule,Paracelsusstraße 44,17763,Stuttgart,Plieningen,Stuttgart,Baden-Württemberg,48.706771533607295,9.209675274225509,0711 21698380,,poststelle.koerschtalschule@stuttgart.de,https://koerschtalschule.de/,,Öffentlich,Frau Lenuzza,,60.0,,,"Künstlerisches Profil, Projektbasiertes Lernen, Emotionale und soziale Bildung, Inklusion, Schule ohne Rassismus Schule mit Courage",0,4,Echterdingen,3379,48.6921433,9.1693145,,Ruit,4200,48.7312905,9.2532278,,Leinfelden,5037,48.6966965,9.1427508,,Stadionstraße,2857,48.6945466,9.1754327,,Schelmenwasen,2884,48.707677,9.1703979,,EnBW City,3146,48.7117374,9.1674598,,Bus (48.7143),881,48.7143425,9.2061214,,Fruwirthstraße,886,48.7143646,9.2060306,,Bus (48.7145),898,48.714503,9.2061518,,,8.0,10,3.3,0,1,9,1,3,5,17,Plieningen,Stuttgart,761,5408.5,52.3,0.5,stuttgart.de Adressverzeichnis,2026-04-06,"2024,2023,2022",Unfallatlas,14070,bezirk_estimated,5408.5,5,38.6,76,540.6,39,278.1,13,95.6,2.0,Supermarkt Diamound,"Plieningen, 70599 Stuttgart, Germany",389.0,48.708683099999995,9.2052346,Saengthongfoods UG,"Breitensteinstraße 2, 70599 Stuttgart, Germany",442.0,48.7031605,9.2121961,,,,,,1.0,Cafe Lafel - Uni Hohenheim,"Garbenstraße 28, 70599 Stuttgart, Germany",484.0,48.711079,9.2086941,,,,,,,,,,,0.0,,,,,,,,,,,,,,,,2.0,Tageseinrichtung für Kinder Körschstraße,"Plieningen, 70599 Stuttgart, Germany",325.0,48.7039584,9.2084727,Hohenheimer Zwerge (KUB e.V.),"Filderhauptstraße 89, 70599 Stuttgart, Germany",496.0,48.703939299999995,9.2044545,Tageseinrichtung für Kinder Köpfertstraße,"Köpfertstraße 30, 70599 Stuttgart, Germany",541.0,48.7026066,9.205859300000002,0.0,Grundschule Birkach,"Parkplatz, Parkplatz, Moosheimer Str. 11, 70599 Stuttgart, Germany",1714.0,48.7220807,9.2069541,Bruckenacker Verlässliche Grundschule,"Fröbelstraße 15, 70794 Filderstadt, Germany",2908.0,48.681573799999995,9.2202609,Grundschule Wasenäckerschule Scharnhausen,"Fröbelstraße 9, 73760 Ostfildern, Germany",3495.0,48.7071106,9.2572976,3.0,,,"Körschtalschule Gemeinschaftsschule in Stuttgart-Plieningen is a public educational institution that has operated as a Gemeinschaftsschule (comprehensive school) since 2014, offering an inclusive learning environment from primary to secondary levels. Its pedagogical concept is based on individualized support through tailored learning paths, project-based learning to develop creative and critical thinking, and a strong focus on emotional and social education, emphasizing empathy, respect, and teamwork. A distinctive feature of the school is its artistic profile, which includes a variety of creative offerings. The school leadership consists of Ms. Lenuzza as the headmistress, and Ms. Prskalo and Ms. B. Beck as deputy headmistresses. The multidisciplinary team includes 25 teachers in the primary school, 35 in the secondary school, and 25 educators in the after-school care program, ensuring holistic support and development. The school also provides comprehensive after-school care for 50 hours per week. Körschtalschule is characterized by its central location close to nature and a wide range of extracurricular activities. It sees itself as a school that embraces diversity as an opportunity and imparts values such as inclusion and justice.","Die Körschtalschule Gemeinschaftsschule in Stuttgart-Plieningen ist eine öffentliche Bildungseinrichtung, die seit 2014 als Gemeinschaftsschule fungiert und eine integrative Lernumgebung von der Grundschule bis zur Sekundarstufe bietet. Ihr pädagogisches Konzept basiert auf individueller Förderung durch maßgeschneiderte Lernwege, projektbasiertem Lernen zur Entwicklung kreativen und kritischen Denkens sowie einem starken Fokus auf emotionale und soziale Bildung, die Empathie, Respekt und Teamarbeit in den Vordergrund stellt. Ein besonderes Merkmal der Schule ist ihr künstlerisches Profil, das vielfältige kreative Angebote umfasst. Die Schulleitung besteht aus Frau Lenuzza als Schulleiterin sowie Frau Prskalo und Frau B. Beck als stellvertretende Schulleiterinnen. Das multiprofessionelle Team umfasst 25 Lehrkräfte in der Grundschule, 35 in der Sekundarstufe und 25 Pädagogen in der Schulkindbetreuung, die eine ganzheitliche Betreuung und Förderung gewährleisten. Die Schule bietet zudem eine umfassende Schulkindbetreuung von 50 Stunden pro Woche an. Die Körschtalschule zeichnet sich durch ihre zentrale Lage mit Naturnähe und ein breites Angebot an außerschulischen Aktivitäten aus. Sie versteht sich als eine Schule, die Vielfalt als Chance begreift und Werte wie Inklusion und Gerechtigkeit vermittelt.","Körschtalschule Gemeinschaftsschule in Stuttgart is a public school offering primary and secondary education since 2014. It is characterized by individualized support, an artistic profile, project-based learning, and a focus on social education. The team comprises 25 primary teachers, 35 secondary teachers, and 25 educators for after-school care.","Die Körschtalschule Gemeinschaftsschule in Stuttgart ist eine öffentliche Schule, die seit 2014 Grund- und Sekundarbildung anbietet. Sie zeichnet sich durch individuelle Förderung, ein künstlerisches Profil, projektbasiertes Lernen und einen Fokus auf soziale Bildung aus. Das Team besteht aus 25 Grundschullehrern, 35 Sekundarschullehrern und 25 Pädagogen für die Schulkindbetreuung."
